Title,Publication Year,Image URL,Article Content,Article Description
VIDEO: COMMUTE | A Cinematic Cycling Film,2024,https://media.theradavist.com/uploads/2024/03/COMMUTEvideo.jpeg?w=1200&quality=75,"Dive into the compelling story of Kaldwell Grant, an Oklahoma City local whose mode of transportation is as unique as his journey. Navigating the challenging roads of Oklahoma City, Kaldwell embraces… [+304 chars]","Dive into the compelling story of Kaldwell Grant, an Oklahoma City local whose mode of transportation is as unique as his journey. Navigating the challenging roads of Oklahoma City, Kaldwell embraces a 10-mile commute solely on his bike. Despite the city’s bi…"
Op-Ed: It’s Time for More of the Bike Industry to Evolve Beyond Toxic Racing Culture,2024,https://bikerumor.com/wp-content/uploads/2024/03/Toxic-Racing-Culture-OpEd-Path-Less-Pedaled-sticker-e1710438202923.jpeg,"This will likely be an inflammatory statement: racing culture is toxic and harmful to our industry. That’s it. 
We all have opinions, and this is mine. 
I’m not saying that race culture shouldn’t e… [+6834 chars]","Cycling Lifestyle Editor, Ron shares his opinion on cycling race culture, and why you should just ride your bike.
The post Op-Ed: It’s Time for More of the Bike Industry to Evolve Beyond Toxic Racing Culture appeared first on Bikerumor."
"New model integrates soil microbes, large perennial grasses",2024,https://scx2.b-cdn.net/gfx/news/2024/daycent-cabbi-new-mode.jpg,"This article has been reviewed according to Science X's 
editorial process
and policies.
Editors have highlighted
the following attributes while ensuring the content's credibility:
fact-checked… [+5900 chars]","Of all the carbon stored in ecosystems around the world, about half can be found in soils. Depending on climate, vegetation, and management, soils can be either a carbon source or a sink."
Save 20% on Cycling Gear During the REI Member Moment Sale,2024,https://bikerumor.com/wp-content/uploads/2024/03/REI_Co_op_ebike.jpg,"The REI Member Moment Sale is your seasonal opportunity to save on bikes, shoes, or apparel as well as get early access to exclusive items.
During the Member Moment Sale, March 1525, members can use… [+4845 chars]","Just in time for your spring rides, the REI Member Moment Sale is your go-to source for scoring deals on new cycling gear.
The post Save 20% on Cycling Gear During the REI Member Moment Sale appeared first on Bikerumor."
Understanding soil carbon's sensitivity to increasing global temperatures,2024,https://scx2.b-cdn.net/gfx/news/hires/2024/understanding-soil-car.jpg,"This article has been reviewed according to Science X's 
editorial process
and policies.
Editors have highlighted
the following attributes while ensuring the content's credibility:
fact-checked… [+2474 chars]",Particulate soil carbon may be more vulnerable to microbial decomposition under warmer temperatures associated with climate change.
Strategies to Resist Yo-Yo Dieting Culture,2024,https://cdn2.psychologytoday.com/assets/styles/manual_crop_1_91_1_1528x800/public/teaser_image/blog_entry/2024-04/fruits-1114060_1280.jpg?itok=8LnKCwNB,"As products of U.S diet culture, we grow up learning that we need to conform to Americas thin and muscular ideals or risk being looked down upon and discriminated against. After all, despite body acc… [+5098 chars]",New research shows what to do instead.
Mathieu Van Der Poel Signs Unprecedented 10 Year Contract with Canyon,2024,https://ep1.pinkbike.org/p4pb26367181/p4pb26367181.jpg,"Mathieu van der Poel has signed the longest-known contract in modern-day cyclingwith Canyon Bicycles. The current Road and Cyclocross World Champion went to Canyons headquarters in Koblenz, Germany o… [+1637 chars]","Mathieu van der Poel has signed the longest-known contract in modern-day cycling  with Canyon Bicycles.( Photos: 3, Comments: 5 )"
"What Sean ""Diddy"" Combs Is Up to in Miami After Home Raids",2024,"https://akns-images.eonline.com/eol_images/Entire_Site/202434/cr_1200x1200-240404131945-GettyImages-1641348632.jpg?fit=around%7C1080:1080&output-quality=90&crop=1080:1080;center,top","Sean ""Diddy"" Combs is taking it day by day.
More than one week after two of his residences were raided by federal agents, the ""I'll Be Missing You"" rapper was seen biking around Miami. Combs, wearin… [+774 chars]","Sean ""Diddy"" Combs is taking it day by day.
More than one week after two of his residences were raided by federal agents, the ""I'll Be Missing You"" rapper was seen biking around Miami. Combs,..."
Dragon's Dogma 2 - Warfarer And Newt Liqueur Guide,2024,https://www.gamespot.com/a/uploads/screen_kubrick_large/1816/18167535/4277863-dragons-dogma-2-warfarer-newt-liqueur-guide-.jpg,"You can choose from several vocations or classes in Dragon's Dogma 2. However, you're limited to just one that's active for the most part. Much later, though, you'll gain access to something that all… [+5229 chars]","You can choose from several vocations or classes in Dragon's Dogma 2. However, you're limited to just one that's active for the most part. Much later, though, you'll gain access to something that allows you to mix-and-match based on your needs. Here's our gui…"
Birding Under The Influence By Dorian Anderson — Review,2024,"https://imageio.forbes.com/specials-images/imageserve/65ff194d2ccb9152d392146c/0x0.jpg?format=jpg&crop=812,456,x0,y57,safe&height=900&width=1600&fit=bounds",An uplifting and hopeful memoir and social commentary about healing from alcoholism and drug addiction by becoming deeply immersed in the natural world through bird watching whilst bicycling across t… [+5873 chars],A hopeful memoir about healing from alcoholism and drug addiction by becoming deeply immersed in the natural world through bird watching whilst bicycling across the USA.
Tropical cyclones may be an unlikely ally in the battle against ocean hypoxia,2024,https://scx2.b-cdn.net/gfx/news/hires/2024/tropical-cyclones-may.jpg,"This article has been reviewed according to Science X's 
editorial process
and policies.
Editors have highlighted
the following attributes while ensuring the content's credibility:
fact-checked… [+4180 chars]","Tropical cyclones, also known as hurricanes and typhoons, are meteorological phenomena that occur over tropical and subtropical oceans experiencing low atmospheric pressure, where water vapor from the warm oceans condenses to produce spiraling cloud formation…"
Microorganisms may be essential to the survival of coral reefs threatened by climate change,2024,https://scx2.b-cdn.net/gfx/news/hires/2024/research-identifies-mi-1.jpg,"This article has been reviewed according to Science X's 
editorial process
and policies.
Editors have highlighted
the following attributes while ensuring the content's credibility:
fact-checked… [+3320 chars]",A study led by a researcher at the University of Stirling has identified microscopic organisms that may be crucial to the survival of coral reefs.
"New approach to monitoring freshwater quality can identify sources of pollution, predict their effects",2024,https://scx2.b-cdn.net/gfx/news/hires/2024/new-approach-to-monito-1.jpg,"This article has been reviewed according to Science X's 
editorial process
and policies.
Editors have highlighted
the following attributes while ensuring the content's credibility:
fact-checked… [+3700 chars]","The source of pollutants in rivers and freshwater lakes can now be identified using a comprehensive new water quality analysis, according to scientists at the University of Cambridge and Trent University, Canada."
'I genuinely wasn't sure if I still had a husband': Aussie cyclist's wife reveals she feared the worst after horror crash in Spain,2024,https://live-production.wcms.abc-cdn.net.au/60bd2b92af2c2e7bc80000045ea08a8e?impolicy=wcms_watermark_news&cropH=545&cropW=969&xPos=0&yPos=167&width=862&height=485&imformat=generic,<ul><li>In short: Bre Vine said she feared the worst after seeing husband Jay prostrate in a ditch after the crash.</li><li>Vine's team confirmed he suffered a cervical and two thoracic spine vertebr… [+3498 chars],"Bre Vine says she feared the ""worst had happened"" after husband Jay was caught up in a horror cycling crash in Spain, that has left the Aussie with spinal fractures."
We’re Giving Away Copies of the LIVE TO RIDE Book: Comment Below to Win!,2024,https://media.theradavist.com/uploads/2024/03/LiveToRideBook-1.jpg?w=1200&quality=75,"We brake for great cycling books. Cycling journalist Peter Flax pinged the Grubers, John, and others to submit photos for his new book, LIVE TO RIDE. We got our hands on a few extra copies of this be… [+807 chars]","We brake for great cycling books. Cycling journalist Peter Flax pinged the Grubers, John, and others to submit photos for his new book, LIVE TO RIDE. We got our hands on a few extra copies of this beautifully written and laid-out book, so we're going to give …"
RingConn Smart Ring review: Simple yet sharp,2024,https://static1.anpoimages.com/wordpress/wp-content/uploads/wm/2024/03/ringconn-smart-ring-hero.JPG,"Smart rings are on the cusp of having their iPhone moment — finally becoming mainstream after years of struggling and trying to carve a space for themselves. There are many reasons for this, includin… [+8713 chars]","RingConn is a new player in the growing smart ring category of fitness trackers, with ignorable cons and a subscription-free experience."
Tour of Flanders 2024: How to Watch a UCI World Tour Cycling Livestream for Free - CNET,2024,https://www.cnet.com/a/img/resize/40aa33a6900777e4d344539b30c5b18adefe9da0/hub/2024/03/29/b3a5df38-3015-40b5-93d7-6c7246d120fe/gettyimages-1479078206.jpg?auto=webp&fit=crop&height=675&width=1200,"Belgium's biggest and arguably toughest race of the UCI World Tour calendar is upon us, as the riders take on the cobbles of the Tour of Flanders this Saturday. 
The men's race follows a scenic 271-… [+5178 chars]",The world's best riders take on the second classic Monument of the 2024 season.
"Man Man announce new album, share “Iguana”",2024,https://www.brooklynvegan.com/wp-content/uploads/2024/03/20/man-man-photo-by-ebru-yildiz.jpeg,"Man Man have announced a new album, Carrot on Strings, which will be out June 7 via Sub Pop. “When I was younger, I would feed off of chaos. I would, you know, be upset and get drunk and smash chairs… [+965 chars]","Man Man have announced a new album, Carrot on Strings, which will be out June 7 via Sub Pop. “When I was younger, I would feed off of chaos. I would, you know, be upset and get drunk and smash chairs. Physically demonstrative of my emotions,” says Ryan Kattne…"
"Rapha Letras, Reis & Dalton Shades Expand Classic and Wraparound Sunglasses Options",2024,https://bikerumor.com/wp-content/uploads/2024/03/2024-Rapha-Eyewear-adds-3-new-cycling-sunglasses-styles_Reis-half-frame-shades.jpg,Rapha reshapes their performance cycling sunglasses line-up with three new styles that are generally smaller and less flashy than their prior eyewear collections. The new half-frame Reis and frameles… [+5500 chars],"All-new Rapha Letras, Reis & Dalton sunglasses reshape full-coverage performance cycling eyewear with 3 sleek new looks...
The post Rapha Letras, Reis & Dalton Shades Expand Classic and Wraparound Sunglasses Options appeared first on Bikerumor."
Round Up: April Fools Jokes From Around the Cycling Industry - 2024,2024,https://ep1.pinkbike.org/p4pb26432333/p4pb26432333.jpg,"We all need some laughs once in a while. We hope you enjoyed some of the finest pink bikes of Pinkbike this morning. Here are some of the other jokes we've spotted from around the bike industry:
PRE… [+10720 chars]","We hope you enjoyed some of the finest pink bikes of Pinkbike this morning.( Photos: 22, Comments: 3 )"
Learn to challenge your balance with a fun workout from Shilpa Shetty Kundra,2024,https://images.indianexpress.com/2024/03/shilpa-shetty-kundra_1600_insta-1.jpg,There is always the inspiration coming from the best. Who else than actor Shilpa Shetty Kundra? The Sukhee actor took to Instagram recently to share a glimpse of a few stretches that challenged her c… [+2484 chars],"Shilpa Shetty Kundra shared her core balance exercises on Instagram. Experts say weak core can lead to back pain, poor posture and difficulty balancing. Core strengthening exercises can improve stability, reduce pain, improve flexibility and help prevent inju…"
Why Shawn Johnson's Kids Are Excited for Their Trip to the Olympics,2024,"https://akns-images.eonline.com/eol_images/Entire_Site/2021615/rs_1200x1200-210715163959-1200-Shawn-Johnson-2008-olympics.jpg?fit=around%7C1080:1080&output-quality=90&crop=1080:1080;center,top","Attending the 2024 Olympics in Paris this summer, Shawn Johnson East and husband Andrew East are stoked to root on their fellow American athletes as they attempt feats in basketball, cycling, swimmin… [+967 chars]","While Shawn Johnson East is thrilled to cheer for her fellow athletes at the 2024 Olympics, she told E! News that when it comes to impressing her kids, they have competition from an unexpected source."
Cycling 74 Max 8.6.2,2024,,"Max is a visual programming language for the specialized needs of artists, educators, and researchers working with audio, visual media, and physical computing. 
Discover a new landscape of sonic pos… [+1244 chars]","Max is a visual programming language for the specialized needs of artists, educators, and researchers working with audio, visual media, and physical computing. Discover a new landscape of sonic possibilities With MC, objects and patch cords contain multiple a…"
Bifunctional catalyst enables high-performance batteries for sustainable energy storage,2024,https://scx2.b-cdn.net/gfx/news/hires/2024/efficient-bifunctional.jpg,"This article has been reviewed according to Science X's 
editorial process
and policies.
Editors have highlighted
the following attributes while ensuring the content's credibility:
fact-checked… [+3576 chars]",Zinc–nitrate batteries are a primary non-rechargeable energy storage system that utilizes the redox potential difference between zinc and nitrate ions to store and release electrical energy. A research team co-led by chemists from City University of Hong Kong…
Fresh appeal in hunt for answers over missing teen,2024,https://ichef.bbci.co.uk/news/1024/branded_news/139B0/production/_106340308_aprilblurred.jpg,"Police officers have issued a fresh appeal for information to help solve the disappearance of a teenage girl 55 years ago.
April Fabb, 13, was last seen near her home in Metton, Norfolk, on 8 April … [+1413 chars]",Police say loyalties and circumstances may have changed since April Fabb's disappearance.
The HIMIWAY C5 electric motorbike takes eBikes to a whole new level,2024,https://phandroid.com/wp-content/uploads/2024/03/Himiway-C5.jpg,"Electric motorbikes are a total game-changer. Similar to electric cars, they can zip around with an insane torque and dont make a sound, unlike dirt bikes or those massive hogs that can be loud and s… [+6109 chars]","If you love the great outdoors and want a cool and fun way to get around, then maybe the Himiway C5 electric motorbike could be for you.
The post The HIMIWAY C5 electric motorbike takes eBikes to a whole new level appeared first on Phandroid."
Xiaomi Watch 2 Review: Best Budget Wear OS Watch?,2024,https://phandroid.com/wp-content/uploads/2024/03/xiaomi-watch2-review-3.png,"As far as Wear OS devices go, theres no shortage of wearables to choose from, thanks to a wide range of models from brands like Samsung, Xiaomi, Google, and more recently, OnePlus. With that in mind … [+5722 chars]","Is the Xiaomi Watch 2's low price enough to justify a purchase?
The post Xiaomi Watch 2 Review: Best Budget Wear OS Watch? appeared first on Phandroid."
UCI Gives Update on Hookless Rims with Tubeless Tires Ahead of Paris Roubaix,2024,https://bikerumor.com/wp-content/uploads/2023/07/UCI-Logo.jpg,"Just as the cycling world is preparing for one of the biggest single-day races of the season, the UCI has announced its first guidelines on the subject of hookless rims with tubeless tires. The annou… [+3692 chars]","From the latest announcement, it's clear that the UCI is working on... something.
The post UCI Gives Update on Hookless Rims with Tubeless Tires Ahead of Paris Roubaix appeared first on Bikerumor."
[Removed],1970,,[Removed],[Removed]
[Removed],1970,,[Removed],[Removed]
Razer Seiren V3 Chroma review: This microphone will light up your life,2024,https://static1.xdaimages.com/wordpress/wp-content/uploads/wm/2024/03/razer-seiren-v3-chroma-hero.jpg,"Key Takeaways
<ul><li> Excellent recording quality with easy setup and Chroma RGB lighting for a premium feel. </li><li> USB microphone without need for drivers, but software enhances features like … [+6609 chars]",Razer's new Chroma-powered microphone records as well as it looks.
Halloysite-derived mesoporous silica with high ionic conductivity improves Li-S battery performance.,2024,,"R. Ao, Z. Zhu, S. Zhang, Q. Zhang, C. Yan, F. Tu, T. Li, M. G. Li, L. Fu, A. Tang and H. Yang,
 Chem. Commun., 2024, Accepted Manuscript
, DOI: 10.1039/D4CC01111B
To request permission to reproduc… [+657 chars]","Chem. Commun., 2024, Accepted ManuscriptDOI: 10.1039/D4CC01111B, CommunicationRanxiao Ao, Ziqi Zhu, Shilin Zhang, Qiang Zhang, Chenyu Yan, Feiyue Tu, Tianbao Li, Mitch Guijun Li, Liangjie Fu, Aidong Tang, Huaming YangThe slow Li+ transport rate in thick sulfu…"
[Removed],1970,,[Removed],[Removed]
[Removed],1970,,[Removed],[Removed]
Do I need an e-bike or not?,2024,https://www.rawstory.com/media-library/image.jpg?id=51935441&width=980,"While the public awaits Maui County's official report on the cause of the fire, lawyers for victims and insurers say Pole 7A set off a cascade of events that led to a wall of flame.
Maui lawyer Jan … [+7394 chars]","When it comes to buying a new bike you’ll probably find yourself asking whether a conventional pedal bike is right for you or whether you should go electric. The pd-f, a cycling organization in Germany, has a few tips. With an electric bike the support provid…"
A Roadmap for Today’s Entrepreneurs,2024,https://hbr.org/resources/images/article_assets/2020/09/wide-ideacast.png,"ALISON BEARD: Welcome to the HBR IdeaCast from Harvard Business Review. I’m Alison Beard.
So many people in business today aspire to entrepreneurship. Whether you have an idea for a start-up or want… [+25390 chars]",A conversation with MIT Sloan’s Bill Aulet on how to navigate a fast-changing landscape.
BIKE Magazine - April 2024,2024,,"BIKE Magazine is the UKs cycling and travel publication for getting out and enjoying the world of cycling. With specialist features on leisure, touring, sportives, commuting and family cycling we aim… [+351 chars]","BIKE Magazine is the UK’s cycling and travel publication for getting out and enjoying the world of cycling. With specialist features on leisure, touring, sportives, commuting and family cycling we aim to inspire regular riding. We offer product reviews and eB…"
How Exercise Helps Boost Your Memory-Brain Health as You Age - CNET,2024,https://www.cnet.com/a/img/resize/42e5b735e5b38bea520e3ceb06c6871189f5953f/hub/2024/03/20/b14749aa-f880-428a-be0f-b5cb7bd0bc58/gettyimages-1162834320.jpg?auto=webp&fit=crop&height=675&width=1200,"As we age, many of us will notice that our memory isn't as sharp as it used to be. You may have trouble remembering where you left your keys or find it difficult to recall specific events. Still, alt… [+9093 chars]",Regular exercise can help keep your brain happy and healthy.
Molecular circadian rhythms are robust in marine annelids lacking rhythmic behavior,2024,https://journals.plos.org/plosbiology/article/figure/image?id=10.1371/journal.pbio.3002572.g006&size=inline,"Citation: Häfker NS, Holcik L, Mat AM, ori A, Vadiwala K, Beets I, et al. (2024) Molecular circadian rhythms are robust in marine annelids lacking rhythmic behavior. PLoS Biol 22(4):
 e3002572.
htt… [+91507 chars]","Behavioral rhythmicity is often used as a readout for organismal rhythmicity. This study reports high individual diversity in circadian behavioral patterns in a marine annelid worm, showing that behavioral rhythmicity is not correlated with the relative fract…"
The first Six Senses in the Caribbean is now open,2024,https://thepointsguy.global.ssl.fastly.net/us/originals/2024/04/a-warmhearted-welcome-to-six-senses-la-sagesse-grenada-4.jpeg,"This week, the Caribbean is getting a lush and luxurious new IHG resort, Six Senses La Sagesse, which also happens to be the very first Six Senses in the region.
Included on TPG's list of the 56 mos… [+3849 chars]","This week, the Caribbean is getting a lush and luxurious new IHG resort, Six Senses La Sagesse, which also happens to be the very first Six Senses in the region. Included on TPG’s list of the 56 most exciting hotels opening in 2024, this new Six Senses is fou…"
The Garmin Forerunner 255 just received a serious 29% price cut at Amazon ahead of Prime Day,2024,https://cdn.mos.cms.futurecdn.net/jMuxm4Lyv3yYtLonFnQCCG-1200-80.jpg,"Amazon’s spring Prime Day 2024 is a matter of hours away, but don’t think it’s too early to start browsing for the best offers. This Prime Day sale is set to be great for snagging offers on tech that… [+2039 chars]","Amazon’s spring Prime Day sale is just around the corner, and the deals are already here: including this offer on the Garmin Forerunner 255"
Ed Brown Releases 1911 Flat Wire Recoil System,2024,https://www.thefirearmblog.com/blog/wp-content/uploads/2024/04/fdhfghfgh.png,You can now enhance your 1911 pistols with Ed Brown‘s Flat Wire Recoil System. This new set features a durable stainless steel guide rod paired with a long-lasting chrome silicon flat wire spring and… [+2105 chars],"You can now enhance your 1911 pistols with Ed Brown‘s Flat Wire Recoil System. This new set features a durable stainless steel guide rod paired with a long-lasting chrome silicon flat wire spring and plug. According to Ed Brown, this upgrade will increase the…"
[Removed],1970,,[Removed],[Removed]
[Removed],1970,,[Removed],[Removed]
State Bicycle Co Ride Together Grant,2024,https://media.theradavist.com/uploads/2024/04/RideTogetherGrantStateBicycle.jpg?w=1200&quality=75,"State Bicycle Co just announced a new partnership with Grassroots Gravel and the Ride Together Grant. Read on below for the full 411…
Building on the energy, inclusivity, and quality of the inaugural… [+1596 chars]","State Bicycle Co just announced a new partnership with Grassroots Gravel and the Ride Together Grant. Read on below for the full 411... Building on the energy, inclusivity, and quality of the inaugural Grassroots Gravel race in Pueblo, Colorado, last October,…"
Insights on cycling stability of manganese-based zinc-ion batteries: From energy storage mechanisms to capacity fluctuation and optimization strategies,2024,,"Y. Liao, C. Yang, J. Bai, Q. He, H. Wang, H. Chen, Q. Zhang and L. Chen,
 Chem. Sci., 2024, Accepted Manuscript
, DOI: 10.1039/D4SC00510D
This article is licensed under a 
 Creative Commons Attri… [+991 chars]","Chem. Sci., 2024, Accepted ManuscriptDOI: 10.1039/D4SC00510D, Review Article Open Access &nbsp This article is licensed under a Creative Commons Attribution-NonCommercial 3.0 Unported Licence.Yanxin Liao, Chun Yang, Jie Bai, Qingqing He, Huayu Wang, Hai-Chao …"
New Release: Bravur Introduces The New Team Heritage Watches Collection,2024,https://www.ablogtowatch.com/wp-content/uploads/2024/04/Bravur-Team-Heritage-1.jpg,"Any time any brand stops iterating and starts creating, it’s exciting. We live in a (watch) world of incremental changes, with established brands opting for small tweaks like a new dial color or a mo… [+4080 chars]","Any time any brand stops iterating and starts creating, it’s exciting. We live in a (watch) world of incremental changes, with established brands opting for small tweaks like a new dial color or a moved date window over introducing wholly new models. One the …"
Hair-loss treatment found in cinnamon,2024,https://assets.newatlas.com/dims4/default/3d56e09/2147483647/strip/true/crop/1999x1049+0+142/resize/1200x630!/quality/90/?url=http%3A%2F%2Fnewatlas-brightspot.s3.amazonaws.com%2Fdf%2F03%2F155b804449f48736497e16bd031b%2Fdepositphotos-225389776-l.jpg&na.image_optimisation=0,"A component of the aromatic spice cinnamon caused hair follicles to sprout in the lab, with researchers now set on developing a novel treatment to reverse hair loss through the use of natural compoun… [+3744 chars]","A component of the aromatic spice cinnamon caused hair follicles to sprout in the lab, with researchers now set on developing a novel treatment to reverse hair loss through the use of natural compounds.Continue ReadingCategory: ScienceTags: Hair, Baldness, Yo…"
Semi Rad is a Cruiser Bike Guy Now,2024,https://radavist-static-production.s3.amazonaws.com/uploads/2024/04/SemiRadCruiser_Snippet.jpg?w=1200&quality=75,"The Radavist is a group of individuals who share a love of cycling and the outdoors. We will always stop for a photo, or to hit a jump. We believe the outdoors should be respected. Please, pack it in… [+166 chars]","Artist and commentator Semi-Rad is known for his humorous infographics and books. Last week he announced that after years of riding a gravel bike, he’s a die hard cruiser bike guy now. Roll on over to Semi-Rad to see why!
The post Semi Rad is a Cruiser Bike G…"
