Title,Publication Year,Image URL,Article Content,Article Description
"REPORT: 3 Boys Try Fixing Bike, Get Robbed By Armed Men",2024,https://cdn01.dailycaller.com/wp-content/uploads/2024/03/2024-03-19T155844Z_1742184376_RC22P6AR7I28_RTRMADP_3_SPACE-EXPLORATION-BAIKONUR-1-scaled-e1710969278326.jpg,"Three tweens were reportedly trying to fix a bicycle in Glen Burnie, Maryland, over the weekend when three men robbed them of their two-wheeled transportation near a local middle school.
The three y… [+1285 chars]",Three men stole three bikes from little boys in Maryland. The reported robbery took place while the boys were stopped and trying to fix a broken bike chain.
"New pavement, bathrooms, and bike parking coming to McKenzie Pass",2024,https://bikeportland.org/wp-content/uploads/2024/03/Screenshot-2024-03-29-at-10.13.38 AM.jpg,"McKenzie Pass is a hallowed route for many cyclists. The 38 miles of Highway 242 between Sisters and Belknap Springs is some of the best riding not just in Oregon, but anywhere in the world. Already … [+1178 chars]","Honestly, the new bathrooms excite me more than the smooth pavement."
Brothers: A Tale of Two Sons | Why I Love,2024,https://assetsio.gnwcdn.com/brothersmain.jpg?width=1200&height=630&fit=crop&enable=upscale&auto=webp,Why I Love is a series of guest editorials on GamesIndustry.biz intended to showcase the ways in which game developers appreciate each other's work. This entry was contributed by Ember Trail's Cruz S… [+7217 chars],"Why I Love is a series of guest editorials on GamesIndustry.biz intended to showcase the ways in which game developers appreciate each other's work. This entry was contributed by Ember Trail's Cruz Segovia Ardiz, game director of the alien planet management g…"
"90 Day Fiancé: Loren Brovarnik Gives ""Scary"" Update On Husband Alexei's Family In Israel",2024,https://static1.srcdn.com/wordpress/wp-content/uploads/2023/05/sin-ti-tulo-1-6-3.jpg,"Summary
<ul><li> Loren Brovarnik worries about family safety in Israel amid conflict with Hamas. </li><li> Loren receives messages from concerned fans about Alexei's family in Nazareth. </li><li> Lo… [+3569 chars]",90 Day Fiancé: Happily Ever After? star Loren Brovarnik is celebrating son Shai's fourth birthday as she worries about Alexei's family in Israel.
The Best Canadian Whiskies According To The 2024 World Whiskies Awards,2024,https://imageio.forbes.com/specials-images/imageserve/65f4fc38f4f1f6c6447945df/0x0.png?format=png&height=900&width=1600&fit=bounds,"Gibsons Finest, Venerable, 18 YO, 40% ABV won Worlds Best Canadian Blended
Photo, courtesy Gibson's
The top Canadian whiskies were recently announced at the 2024 World Whiskies Awards. Ten Canadian… [+7078 chars]",The top Canadian whiskies were recently announced at the 2024 World Whiskies Awards. Ten Canadian whiskies took top honors in their respective categories.
"Public has ‘only partial information’ on pandemic bicycle case, Garda chief Harris says",2024,https://www.irishtimes.com/resizer/NsMxukj8tdPX3DcbroydlQe1Ihw=/1200x630/filters:format(jpg):quality(70)/cloudfront-eu-central-1.images.arcpublishing.com/irishtimes/FINUNOALOJCKZG2CHQTGNAYR3A.JPG,Garda Commissioner Drew Harris has said that only partial information relating to the case of a garda who gave a bicycle to an elderly man during the Covid-19 pandemic is currently in the public doma… [+2811 chars],Commissioner told the Public Accounts Committee he didn’t agree that the investigation lacked a common-sense approach
US college student critical after she’s run off the road while riding bicycle in Spain,2024,https://nypost.com/wp-content/uploads/sites/2/2024/03/us-student.jpg?quality=75&strip=all&1711243795&w=1024,"A Massachusetts college student studying abroad in Spain suffered a “traumatic brain injury” after she was allegedly run off the road while riding her bicycle. 
Lauren Rauseo, a junior at Stonehill … [+2809 chars]","""She is the last person on earth to ever deserve something like that. She is the sweetest person I have ever met.”"
New Santa Monica Science Fiction Museum Joins Beach City Attractions,2024,https://imageio.forbes.com/specials-images/imageserve/66170a8c60dd2a2116403fa1/0x0.jpg?format=jpg&height=900&width=1600&fit=bounds,"SCI-FI WORLD: The Experience, a new museum in Santa Monica, CA will display the bridge from the Star ... [+] Trek 1966 Original Series set, with statues of the crew. George Takei, ""Sulu"" from the ori… [+6255 chars]","SCI-FI WORLD: The Experience is landing in Santa Monica, CA, in May, with props and replicas from Star Trek, Star Wars, Aliens, Iron Man, Doctor Who, Oblivion and more."
"28 Scrumptious Photos, Served By Food Photographer Of The Year Awards",2024,"https://imageio.forbes.com/specials-images/imageserve/661bdc4f8e8f7f6fc7fc1f58/0x0.jpg?format=jpg&crop=1919,1080,x0,y226,safe&height=900&width=1600&fit=bounds","Vegetable Man, Shortlisted MPB Award for Innovation
Caroline Trotter, UK - Pink Lady® Food Photographer of the Year 2024
The Pink Lady® Food Photographer of the Year 2024 competition, awarding amat… [+6964 chars]",A tempting show of appetizing prize winning images celebrating the universal language of food through the art of photography.
Nvidia’s AI Bot Outperforms Nurses: Here’s What It Means For You,2024,https://imageio.forbes.com/specials-images/imageserve/661f239d613f651acae93ff4/0x0.jpg?format=jpg&height=900&width=1600&fit=bounds,"Nvidia CEO Jensen Huang delivers a keynote address during the GTC Artificial Intelligence Conference ... [+] at SAP Center on March 18, 2024 in San Jose, California.
Getty Images
Soon after Apple r… [+7080 chars]","The chip maker claims its generative AI “agents” surpass human nurses in performing a variety of tasks, all at a markedly reduced cost. Here are three implications."
"The Contenders, Vol. 5: Our running list of the year's best songs",2024,https://media.npr.org/assets/img/2024/03/18/mayabeiser_wide-b2f5cad720a86091f56148ab911b0a6f2d15e0fc-s1400-c100.jpg,On this week's show we check back in on our running tally of songs that could wind up on NPR Music's best-of-2024 lists. Alt.Latino's Anamaria Sayre and NPR's Tom Huizenga join host Robin Hilton to s… [+547 chars],"We update our tally of the year's best contenders with the effervescent Bombay Bicycle Club, Residente's epic and profound ""313,"" cellist Maya Beiser's take on Terry Riley's ""In C"" and more.Alt.Latino's Anamaria Sayre and NPR Music's Tom Huizenga join host Ro…"
Life Is for Living,2024,https://dg.imgix.net/life-is-for-living-cmnbanxx-en/landscape/life-is-for-living-cmnbanxx-91a018c74a8cb5e470aaf98a0585b179.jpeg?ts=1711057681&ixlib=rails-4.3.1&fit=crop&w=2000&h=1050,"Youth, an old writer complained, is wasted on the young. Why hand the strongest draught of life to those who least know what to do with it? Why entrust bright eyes and boundless energy to those blowi… [+8152 chars]","“Youth,” an old writer complained, “is wasted on the young.” Why hand the strongest draught of life to those who least know what to do with it? Why entrust bright eyes and boundless energy to those blowing bubbles and scrolling phones and living best friends …"
Tern Orox All Terrain e-Cargo Bike Review: Packing Lots – John Watson,2024,https://media.theradavist.com/uploads/2024/03/Tern-Orox-e-Cargo-Bike-Review-27.jpg?w=1200&quality=75,"After about a month of using the Tern Orox in a particularly snowy and cold spring in Santa Fe, John has penned a review of the e-cargo platform, which speaks to the bike’s versatility and aligns it … [+19811 chars]","After about a month of using the Tern Orox in a particularly snowy and cold spring in Santa Fe, John has penned a review of the e-cargo platform, which speaks to the bike's versatility and aligns it firmly in the ""car replacement"" category. Let's check it out…"
41k-Mile 1999 Porsche 911 Carrera Cabriolet 6-Speed,2024,https://bringatrailer.com/wp-content/uploads/2024/03/1999_porsche_911-carrera-cabriolet_dsc_0184-77718.jpg,"This 1999 Porsche 911 Carrera cabriolet was manufactured in July 1998, and it was specified in Arctic Silver Metallic over a Metropol Blue partial leather interior. It was optioned with a limited-sli… [+3180 chars]","This 1999 Porsche 911 Carrera cabriolet was manufactured in July 1998, and it was specified in Arctic Silver Metallic over a Metropol Blue partial leather interior. It was optioned with a limited-slip differential, full power-adjustable front seats, 18"" Turbo…"
New Release Spotlight: Becca Kinzer,2024,https://rachellegardner.com/wp-content/uploads/2024/04/Becca-Kinzer_Love-in-Tandem-Instagram-Post-1.png,"Happy release day to author Becca Kinzer! Becca’s second novel “Love in Tandem” hits shelves today.
In this rom-com, Charlotte is perfectly content leading a quiet life in her small hometown. Zach i… [+195 chars]","Happy release day to author Becca Kinzer! Becca’s second novel “Love in Tandem” hits shelves today.   In this rom-com, Charlotte is perfectly content leading a quiet life in her small hometown. Zach is an adventurer with unquenchable wanderlust. The two could…"
Woman who drove off with cyclist on bonnet has past traffic violations; defence seeks fine,2024,"https://onecms-res.cloudinary.com/image/upload/s--BXLGU1Ya--/f_auto,q_auto/c_fill,g_auto,h_676,w_1200/v1/mediacorp/cna/image/2024/02/15/driver_elaine_cyclist_nicolette_composite.jpg?itok=DIuaQYUE","SINGAPORE: A woman who drove off with a cyclist on the bonnet of her car in a viral incident in Katong has past traffic violations for drink driving, running a red light and parking illegally, a cour… [+7287 chars]","The defence said this case was unique and the cyclist was the aggressor while his client was ""harassed"" and merely wanted to leave the scene."
Trailer Released for Upcoming New Blue Angels IMAX Reality-Style Documentary,2024,https://theaviationist.com/wp-content/uploads/2024/03/Blue-Angels-trailer.jpg,"A screenshot of the trailer. (Image credit: Prime Video)
A video trailer for the upcoming release of Amazon Studios new documentary on the U.S. Navy Flight Demonstration Team, The Blue Angels has de… [+2446 chars]","“The Blue Angels” from Amazon Studios/Prime Video Showcases Drama of Airshow Season Preparation. A video trailer for the upcoming release of Amazon Studios’ new documentary on the U.S. Navy Flight Demonstration Team, The Blue Angels [...]
The post Trailer Rel…"
"Video: Filmmakers test-drive OpenAI’s Sora, inspiring awe – and concern",2024,https://assets.newatlas.com/dims4/default/74b0696/2147483647/strip/true/crop/2000x1050+0+142/resize/1200x630!/quality/90/?url=http%3A%2F%2Fnewatlas-brightspot.s3.amazonaws.com%2Fa9%2Fb5%2F51805fcb40808354b77a83d7bf12%2Fair-head.jpg&na.image_optimisation=0,"OpenAI has again demonstrated the capabilities of its already impressive text-to-video platform, Sora, by asking creatives to produce their own short films using it. The public's response has been a … [+8599 chars]","OpenAI has again demonstrated the capabilities of its already impressive text-to-video platform, Sora, by asking creatives to produce their own short films using it. The public's response has been a mixture of awe and fear about the potential uses of this tec…"
89-year-old Japanese man rides bike 600 kilometers to visit his 61-year-old son,2024,https://soranews24.com/wp-content/uploads/sites/3/2024/04/BR-1.jpg?w=1200&h=630&crop=1,"Just a quick little ride from Kobe to Tokyo.
A couple of weeks ago, Mitsuo Tanigami, a resident of Kobe, decided he wanted to see his kids. However, both his son, Naoya, and his daughter, Sayuri, ar… [+3577 chars]","Just a quick little ride from Kobe to Tokyo. A couple of weeks ago, Mitsuo Tanigami, a resident of Kobe, decided he wanted to see his kids. However, both his son, Naoya, and his daughter, Sayuri, are grown up and moved out of the house, so it wasn’t as simple…"
Bicycle Apparel Market to Hit US$ 7.98 Billion at 5.6% CAGR by 2034: Fact.MR Report,2024,https://ml.globenewswire.com/Resource/Download/f482b854-04d1-4f4e-9237-f7c7c6823e10,"Rockville, March 19, 2024 (GLOBE NEWSWIRE) -- Research conducted by market research and competitive intelligence source Fact.MR projects that in 2024, the worldwide bicycle apparel market
 will be w… [+6662 chars]",Bicycle Apparel Market Exhibiting Steady Growth Due to Increase in Popularity of Recreational Activities Bicycle Apparel Market Exhibiting Steady Growth Due to Increase in Popularity of Recreational Activities
"Atech Innovation AirTag Multitool 7-in-1 Pro combines a bottle opener, phone stand & more",2024,https://thegadgetflow.com/wp-content/uploads/2024/04/Atech-Innovation-AirTag-Multitool-7-in-1-Pro-01.jpg,"This item is eligible for $9 OFF
Discount
Get functionality from your AirTag holder when you pair it with the Attech Innovation AirTag Multitool 7-in-1 Pro. It gives you 7 different EDC tools.
7 T… [+729 chars]",Get functionality from your AirTag holder when you pair it with the Attech Innovation AirTag Multitool 7-in-1 Pro. It gives you 7 different EDC tools.   –7 Tools in One: This AirTag multitool features a keychain and carabiner for easy..
"Today’s Rental was chosen for the kitchen and plants, obviously",2024,https://s26552.pcdn.co/wp-content/uploads/2024/03/kitchen-6.jpg,"This rental is located at 2201 Second Street NW near W. The Craigslist ad says:
“$2,500 / 1br – 775ft2 – Bright, Top-Floor Corner 1 Bedroom (Bloomingdale) 
The BasicsOne-bedroom, one-bath top floor… [+1717 chars]","This rental is located at 2201 Second Street NW near W. The Craigslist ad says: ""$2,500 / 1br - 775ft2 - Bright, Top-Floor Corner 1 Bedroom (Bloomingdale) The Basics One-bedroom, one-bath top floor corner unit in a quiet, secure, and well-maintained walk-up c…"
Best Bite in Town S01E01 1080p WEB h264-FREQUENCY,2024,,"Best Bite in Town, where Guy will appoint some of his chef friends to hit the road to visit different cities each week, competing to find the very best bite in town.
Season 1, Episode 01 Guy Fieri s… [+914 chars]","Best Bite in Town, where Guy will appoint some of his chef friends to hit the road to visit different cities each week, competing to find the very best bite in town.Season 1, Episode 01 – Guy Fieri sends his buddy Noah Cappe along with acclaimed chefs Tiffani…"
"Gocio 500W 26"" Electric Commuter Bicycle for $478 + free shipping",2024,"https://c.dlnws.com/image/upload/f_auto,t_maximum,q_auto/content/swprrzb9ib5nykiwfanm.jpg","moreSave on chairs, tents, coolers, backpacks, mattresses, flashlights, and more. We've pictured the Ozark Trail Camping Director Chair for $35 ($40 off). Choose in-store pickup where available to do… [+95 chars]","It's the best price we've seen and the lowest we found now by $201. Buy Now at Walmart 
 Features
 <ul> <li>48V battery</li> <li>21 speeds</li> <li>500W high-speed brushless motor</li> <li>E-bike, Assisted bicycle, and Normal bicycle, with uphill booster mo…"
[Removed],1970,,[Removed],[Removed]
Is there a difference between road and mountain bike saddles?,2024,https://off.road.cc/sites/default/files/styles/640body/public/thumbnails/image/2023%20dmr%20stage%202%20saddle%20hero.jpg?itok=MYZRz41W,"There are three contact points between rider and bicycle and on road and mountain bikes, two look very different, while the third seems very similar. Were referring to handlebars, pedals and saddles.… [+5425 chars]","There are three contact points between rider and bicycle and on road and mountain bikes, two look very different, while the third seems very similar. We’re referring to handlebars, pedals and saddles. Those are the key contact points where your hands, feet an…"
"Heybike HERO review: The biggest, chunkiest carbon fiber fat tire e-bike you’ve ever seen",2024,https://i0.wp.com/electrek.co/wp-content/uploads/sites/3/2024/04/heybike-hero-header-image.jpg?resize=1200%2C628&quality=82&strip=all&ssl=1,One of the beautiful things about the state of the electric bicycle industry currently being in the equivalent of the 1920s car market is that you’ve got around a hundred different e-bike companies a… [+5713 chars],One of the beautiful things about the state of the electric bicycle industry currently being in the equivalent of the 1920s car market is that you’ve got around a hundred different e-bike companies all trying new and crazy things with sometimes wildly diverge…
BoneshakerMTB Mountain Bike Club Vintage Show – BoneshakerMTB,2024,https://radavist-static-production.s3.amazonaws.com/uploads/2024/03/BoneshakerMTB-Vintage_MTB-Show-Toronto-10.jpg?w=1200&quality=75,"We’re big vintage bike nuts over here and have dedicated immeasurable energy to documenting these innovative designs and telling their stories. Up in Toronto, BoneshakerMTB hosted a vintage MTB show … [+2132 chars]","We're big vintage bike nuts over here and have dedicated immeasurable energy to documenting these innovative designs and telling their stories. Up in Toronto, BoneshakerMTB hosted a vintage MTB show earlier this month, and you might recognize one of the bikes…"
[Removed],1970,,[Removed],[Removed]
Commuters face delays on Dublin’s M50 due to number of crashes,2024,https://focus.independent.ie/thumbor/I-dyOutXE2iEDGgsNvqRC2v0gBM=/0x0:628x419/628x0/prod-mh-ireland/ccf1238a-e574-48b7-ba2b-36b5604283f1/ff72cfbe-1e50-4784-848a-d6034d4c59b8/ccf1238a-e574-48b7-ba2b-36b5604283f1.jpg,"There is a crash on the M50 northbound in Dublin this morning which may cause delays.Its in the middle lane between Junction 13, Dundrum, and Junction 12, Firhouse.
There is a seperate crash on the … [+239 chars]",There is a crash on the M50 northbound in Dublin this morning which may cause delays.
Fulham fight back from two goals down to earn 3-3 draw at Sheffield United,2024,"https://onecms-res.cloudinary.com/image/upload/s--RRomX_x0--/fl_relative,g_south_east,l_one-cms:core:watermark:reuters,w_0.1/f_auto,q_auto/c_fill,g_auto,h_676,w_1200/v1/one-cms/core/2024-03-30t171813z_1_lynxnpek2t04w_rtroptp_3_soccer-england-shu-ful-report.jpg?itok=8ng2ZI9O",SHEFFIELD :Fulham fought back from two goals down to earn a thrilling 3-3 draw at Sheffield United on Saturday after Bobby Decordova-Reid and Rodrigo Muniz struck late in the second half to earn a po… [+1264 chars],"SHEFFIELD :Fulham fought back from two goals down to earn a thrilling 3-3 draw at Sheffield United on Saturday after Bobby Decordova-Reid and Rodrigo Muniz struck late in the second half to earn a point against the bottom side.United, who earned their first p…"
"“From the River to the Sea.” A Poem by Samer Abu Hawwash, translated by Huda Fakhreddine",2024,https://s26162.pcdn.co/wp-content/uploads/2020/03/palestine.jpg,"From the River to the Sea
every street, every house, every room, every window, every balcony, every wall, every stone, every sorrow, every word, every letter, every whisper, every touch, every glanc… [+3350 chars]","From the River to the Sea every street, every house, every room, every window, every balcony, every wall, every stone, every sorrow, every word, every letter, every whisper, every touch, every glance, every kiss, every tree, every spear of grass, every tear, …"
"Get crafty, toast our co-host, and be a movie star at Bike Happy Hour this week",2024,https://bikeportland.org/wp-content/uploads/2024/03/Screenshot-2024-03-25-at-3.27.35 PM.jpg,"I hope you’ll consider joining us at Bike Happy Hour tomorrow (Weds, 3/27). I realize it’s Spring Break and lots of folks are not on their normal schedules, but BHH will continue on as per usual. And… [+3141 chars]","Make an inner-tube lanyard for your name card, toast a regular, and make your screen debut."
This Wednesday at Bike Happy Hour: Candidate Rex Burkholder and the future of Sandy Blvd,2024,https://bikeportland.org/wp-content/uploads/2024/04/Screenshot-2024-04-09-at-11.57.21 AM-scaled.jpg,"Hope you can swing by Bike Happy Hour tomorrow (Weds, 4/10), because we’ve got two special guests and ample opportunities for activism. We’ll hear from Portland City Council candidate Rex Burkholder,… [+3149 chars]",Don't miss out this week!
"Feedback Sports Gets a Grip on New Mini Needle Nose Pliers, Diagonal Cutters & Adjustable Wrench!",2024,https://bikerumor.com/wp-content/uploads/2024/03/Feedback-Sports-pliers-angle-cutter-adjutable-wrench-7-800x533.jpg,"There are plenty of bike-specific tools, but if you look in almost any mechanic’s toolbox you’ll also find some old standbys. Namely, pliers, wrenches, and cutting tools. Wanting to add to their wide… [+5865 chars]","Whether you're gripping or cutting, Feedback Sports has three new hand tools to help you get the job done.
The post Feedback Sports Gets a Grip on New Mini Needle Nose Pliers, Diagonal Cutters & Adjustable Wrench! appeared first on Bikerumor."
"Commentary: Goodbye SG Bike, farewell to bike-sharing? It doesn’t need to be",2024,"https://onecms-res.cloudinary.com/image/upload/s--nCjjZ5i_--/f_auto,q_auto/c_fill,g_auto,h_676,w_1200/v1/mediacorp/cna/image/2024/03/22/sg_bike.jpg?itok=7PwyNKia","Yet another gap in opportunity arises from the lack of positive social influence. Today, commuting by bike is still far from being a social norm and cycling is arguably more an activity of recreation… [+1097 chars]","Cycling simply never became a habit nor the choice of travel for most, but that can change, say Samuel Chng and Sarah Chan from SUTD’s Lee Kuan Yew Centre for Innovative Cities."
Lack of snow is no barrier for Australian sled dog racers,2024,https://live-production.wcms.abc-cdn.net.au/03cf3ffa62f21fceed0e6fa78f0c3f9e?impolicy=wcms_watermark_news&cropH=2810&cropW=4996&xPos=4&yPos=259&width=862&height=485&imformat=generic,"<ul><li>In short: Sled dog racing, also known as mushing, is a sport that involves a human rider being pulled along by one or more dogs.</li><li>Australian sled dog racers use bicycles, scooters, and… [+2977 chars]",Queensland's balmy weather has not prevented a team of sled dog enthusiasts from starting their own mushing club.
"AOC Is Pushing A Green New Deal For Public Housing. It Calls For EV Chargers, Removing Gas Stoves And More",2024,https://cdn01.dailycaller.com/wp-content/uploads/2024/03/GettyImages-1483641255-1-scaled-e1711024314778.jpg,"Democratic New York Rep. Alexandria Ocasio-Cortez is reportedly planning to propose a new version of the Green New Deal, and it is loaded with provisions designed to make America’s public housing sto… [+4637 chars]",Democratic New York Rep. Alexandria Ocasio-Cortez is back with a new version of the Green New Deal to make America&#039;s public housing stock go green.
Cyclist who jumped onto car bonnet in Katong road rage incident admits harassing driver,2024,"https://onecms-res.cloudinary.com/image/upload/s--Kl4kc6Em--/f_auto,q_auto/c_fill,g_auto,h_676,w_1200/v1/mediacorp/cna/image/2023/09/07/nicolette tan shi en.jpg?itok=mRf7HIVC","SINGAPORE: A cyclist who jumped onto the bonnet of a car after an altercation with the driver has admitted to harassing the driver with her actions.
Nicolette Tan Shi-en, a 32-year-old Singaporean l… [+3037 chars]","Shortly after the incident, Nicolette Tan Shi-en was diagnosed with a brain tumour that her lawyer says could have affected her behaviour."
BEETLEJUICE BEETLEJUICE Footage Introduces Jenna Ortega As Astrid Deetz; Full Trailer Expected Tomorrow,2024,https://comicbookmovie.com/images/articles/banners/209973.jpg,"It's (almost) showtime!
We were expecting the first trailer for Tim Burton's Beetlejuice sequel, Beetlejuice Beetlejuice (oops... does it count if you only type his name three times?), to be release… [+2477 chars]","The first trailer for Tim Burton's Beetlejuice Beetlejuice is expected to arrive at some point tomorrow, and a brief teaser featuring Jenna Ortega's character is now online..."
THE MARVELS Director Nia DaCosta In Talks To Helm Second Movie In 28 YEARS LATER Trilogy,2024,https://comicbookmovie.com/images/articles/banners/210390.jpg,"We recently learned that 28 Days Later director Danny Boyle and writer Alex Garland are set to join forces yet again for a long-awaited sequel to the classic ""zombie"" horror movie, and we now have co… [+2247 chars]","It seems Sony Pictures is wasting little time in enlisting a director for the second film in its planned 28 Years Later trilogy, as The Marvels' Nia DaCosta is reportedly in talks to helm..."
28 YEARS LATER: Jodie Comer And Charlie Hunnam Rumored To Be In Talks To Star In Horror Sequel,2024,https://comicbookmovie.com/images/articles/banners/210284.jpg,The news broke earlier this year that the director (Danny Boyle) and writer (Alex Garland) behind 2002s horror hit 28 Days Later are joining forces yet again for a long-awaited sequel (and potential … [+2350 chars],"Danny Boyle and Alex Garland are set to re-team for a direct sequel to horror classic 28 Days Later, and a new rumor may have revealed which actors are in talks to play the leads..."
Gaza's wasteland seen via bicycle after six months of war,2024,https://i-invdn-com.investing.com/news/world_news_3_69x52._800x533_L_1419494235.jpg,"By Mahmoud Issa Dawoud Abu Alkas Ahmed Zakot Mohammed Salem
DUBAI (Reuters) - Before the Gaza war erupted, the tiny enclave run by the Palestinian militant group Hamas was impoverished and densely p… [+2620 chars]",Gaza's wasteland seen via bicycle after six months of war
