Title,Publication Year,Image URL,Article Content,Article Description
Revealed: The all-new 2025 Indian Scout looks to the past,2024,https://kickstart.bikeexif.com/wp-content/uploads/2024/04/fb.jpg,Motorcycles are becoming more complex by the minute. All the technological frou-frou that the modern market demands makes it harder to create heritage-focused machines with clean lines and minimalist… [+7338 chars],"Motorcycles are becoming more complex by the minute. All the technological frou-frou that the modern market demands makes it harder to create heritage-focused machines with clean lines and minimalistic styling. Released today, the brand new Indian Scout is a …"
1967 Honda CL300 at No Reserve,2024,https://bringatrailer.com/wp-content/uploads/2024/01/1967_honda_cl300_12-6-59354.jpg,"This 1968 Honda CL300 Scrambler spent time in Washington State before it was acquired by the current owner in 2017. Powered by a 305cc four-stroke parallel twin paired with a four-speed transmission,… [+1752 chars]","This 1968 Honda CL300 Scrambler spent time in Washington State before it was acquired by the current owner in 2017. Powered by a 305cc four-stroke parallel twin paired with a four-speed transmission, the bike is finished in silver. It is equipped with a headl…"
VIDEO: Echoes,2024,https://media.theradavist.com/uploads/2024/03/EchoesRaceFaceVideo.jpeg?w=1200&quality=75,"Almost one year after a disastrous trip in the Chilcotin Mountains, which led Race Face athlete Celeste Pomerantz with a dislocated elbow and broken bike, she finds herself exploring a different kind… [+184 chars]","Almost one year after a disastrous trip in the Chilcotin Mountains, which led Race Face athlete Celeste Pomerantz with a dislocated elbow and broken bike, she finds herself exploring a different kind of challenge: How to get your mind back into a confident sp…"
"Noida man receives Rs 7.66 crore bill after Uber auto ride, netizens share similar incidents",2024,https://images.indianexpress.com/2024/04/Image-27.jpg,"An Uber customer Deepak Tenguriya has said he received a Rs 7.66 crore bill after he hailed an auto-rickshaw from the companys app last Friday. Tenguriya, a Noida resident who expected a fare of just… [+2001 chars]",Deepak Tenguriya received a bill for Rs 7.66 crore for the Uber auto-rickshaw ride.
WA star Cameron Bancroft to miss Sheffield Shield final after bike accident,2024,https://live-production.wcms.abc-cdn.net.au/426949bfc6413036bde610e7c74777d5?impolicy=wcms_watermark_news&cropH=1706&cropW=3032&xPos=0&yPos=158&width=862&height=485&imformat=generic,"Star WA opening batter Cameron Bancroft has been ruled out of the Sheffield Shield final against Tasmania.
A WA Cricket spokesperson has confirmed Bancroft suffered an injury after falling off his b… [+557 chars]",Star WA opener Cameron Bancroft is ruled out of the Sheffield Shield final against Tasmania.
Country town builds $1.7m mountain bike park to soften bypass blow and keep community alive,2024,https://live-production.wcms.abc-cdn.net.au/2d2e9e573d8f8c9827ad1f246b8e72fa?impolicy=wcms_watermark_news&cropH=2813&cropW=5000&xPos=0&yPos=195&width=862&height=485&imformat=generic,<ul><li>In short: It's hoped a newly opened mountain bike park will keep visitors coming to Bindoon after a major road bypassing the town opens next year.</li><li>Bindoon Mountain Bike Park has been … [+4451 chars],"With a newly built bypass set to divert traffic around the town of Bindoon in Western Australia, community leaders are thinking outside the box to keep tourist dollars flowing."
2004 Moto Guzzi V11 Coppa Italia at No Reserve,2024,https://bringatrailer.com/wp-content/uploads/2024/03/2004_moto-guzzi_coppa-italia_2004_moto-guzzi_coppa-italia_f0654d6d-14bd-4307-a8eb-73766a82c2c3-6rxsPj-63107-63108-scaled.jpg,"This 2004 Moto Guzzi V11 Coppa Italia is said to be one of 50 examples produced and was acquired in 2022 by the seller from its second owner. It is powered by a 1,064cc V-twin paired with a six-speed… [+1539 chars]","This 2004 Moto Guzzi V11 Coppa Italia is said to be one of 50 examples produced and was acquired in 2022 by the seller from its second owner. It is powered by a 1,064cc V-twin paired with a six-speed transmission, and is finished in red, silver, and green. Fe…"
Cory Ness-Modified 2014 Victory Ness Cross Country,2024,https://bringatrailer.com/wp-content/uploads/2024/03/2014_victory_cross-country-arlen-ness-custom-bagger_img_9999-78483.jpeg,This 2014 Victory Ness Cross Country was modified by Cory Ness for the 2014 Sturgis Build-Off event and it was featured on the March 2015 issue of American Bagger magazine. The bodywork was stretched… [+1628 chars],"This 2014 Victory Ness Cross Country was modified by Cory Ness for the 2014 Sturgis Build-Off event and it was featured on the March 2015 issue of American Bagger magazine. The bodywork was stretched and painted by Cory Ness, and additional modifications incl…"
Upgrade Your Everyday With This Week’s New EDC Releases,2024,https://cdn.everydaycarry.com/thumbnails/24-03-22/165fde1d951622.jpg,"In this roundup, we highlight elevated essentials, exceptional travel gear, and excellent eighth-anniversary flashlight deals.
The Brown Buffalo X Huckberry Collab to Release a Stealthy Style Trio
… [+5783 chars]","submitted by Everyday CarryIn this roundup, we highlight elevated essentials, exceptional travel gear, and excellent eighth-anniversary flashlight deals.
The Brown Buffalo X Huckberry Collab to Release a Stealthy Style Trio
In their first collaboration in 2…"
2021 Ducati Streetfighter V4S,2024,https://bringatrailer.com/wp-content/uploads/2024/04/2021_ducati_streetfighter_img_6152-81737.jpg,"This 2021 Ducati Streetfighter V4S was acquired new by its current owner and was fitted with over $12k in modifications including carbon-fiber bodywork and covers, winglets, rearsets, a Termignoni ex… [+3219 chars]","This 2021 Ducati Streetfighter V4S was acquired new by its current owner and was fitted with over $12k in modifications including carbon-fiber bodywork and covers, winglets, rearsets, a Termignoni exhaust system, wheel and frame sliders, engine component guar…"
1973 Honda XR75 at No Reserve,2024,https://bringatrailer.com/wp-content/uploads/2024/03/1973_honda_xr75_33556aba-3181-4aef-b8c6-093c21d307d6-82290.jpeg,"This 1973 Honda XR75 is said to have been refurbished under previous ownership in 2016, with work having involved overhauling the 72cc four-stroke single and refinishing the bodywork in metallic gray… [+1519 chars]","This 1973 Honda XR75 is said to have been refurbished under previous ownership in 2016, with work having involved overhauling the 72cc four-stroke single and refinishing the bodywork in metallic gray with red graphics. The bike features a four-speed transmiss…"
1970 Bultaco Pursang 250,2024,https://bringatrailer.com/wp-content/uploads/2024/02/1970_bultaco_pursang_20240102_122045_resized_4-90525.jpg,"This 1970 Bultaco Pursang 250 Mk4 was acquired in 2021 by the seller, who undertook a three-year refurbishment that included overhauling the 244cc single and five-speed transmission in addition to pa… [+1794 chars]","This 1970 Bultaco Pursang 250 Mk4 was acquired in 2021 by the seller, who undertook a three-year refurbishment that included overhauling the 244cc single and five-speed transmission in addition to painting the fiberglass bodywork, rebuilding the wheels, cadmi…"
The Art of The Motorcycle showcases India’s two-wheeled legacy from 1950s to 1980s,2024,https://images.indianexpress.com/2024/04/motorcycle.jpg,"The first edition of The Art of The Motorcycle, an exhibition and award show for vintage and classic two-wheelers, was held on March 31 at the Radisson BLU in Hinjewadi in Pune. It brought together m… [+1996 chars]",The event was organised in Pune by automotive historian Adil Jal Adil Jal Darukhanawala's Auto Zone in association with Old School Riders and Spats Garage.
VIDEO: Race Metal Video Series with Miguel | Why Metal? – Miguel Ovalles,2024,https://media.theradavist.com/uploads/2024/03/RACEMETAL_02.png?w=1200&quality=75,"The Radavist is a group of individuals who share a love of cycling and the outdoors. We will always stop for a photo, or to hit a jump. We believe the outdoors should be respected. Please, pack it in… [+166 chars]","For the second installment in our Race Metal Video Series with Miguel Ovalles, he walks us through his current bike and why he’s set on racing a metal bike.    
The post VIDEO: Race Metal Video Series with Miguel | Why Metal? appeared first on The Radavist."
2009 Triumph Bonneville T100 50th Anniversary at No Reserve,2024,https://bringatrailer.com/wp-content/uploads/2024/03/2009_triumph_50th-anniversary-limited-edition-bonneville_2009_triumph_50th-anniversary-limited-edition-bonneville_f859028e-9e18-4da0-b7bd-5fc2c1147e1f-YzDCpT-55644-55645-scaled.jpg,This 2009 Triumph Bonneville T100 50th Anniversary is #284 of 650 examples that were produced to commemorate the 1959 introduction of the Bonneville model. Power is provided by an 856cc parallel twin… [+2680 chars],This 2009 Triumph Bonneville T100 50th Anniversary is #284 of 650 examples that were produced to commemorate the 1959 introduction of the Bonneville model. Power is provided by an 856cc parallel twin with Keihin fuel injection that drives the rear wheel via a…
Living in poorer neighborhoods tied to faster brain aging,2024,https://www.futurity.org/wp/wp-content/uploads/2024/03/poor-neighborhoods-dementia-risk-brain-aging-1600.jpg,"Living in a poorer neighborhood is linked to accelerated brain aging and increased dementia risk early in life, regardless of income level or education, a new study finds.
The study, which appears i… [+5401 chars]","Living in poorer neighborhoods is linked to higher risk of dementia and faster brain aging, according to new research."
Maeving’s Electric Motorcycles Offer Zero-Emission Thrills With A Healthy Dose Of Nostalgia,2024,https://cleantechnica.com/wp-content/uploads/2024/04/Maeving-RM1S-electric-800x429.png,"Sign up for daily news updates from CleanTechnica on email. Or follow us on Google News!
The body of Maeving’s electric motorcycles emulate the iconic look of the café racers and bobbers of yesterye… [+2361 chars]","The body of Maeving’s electric motorcycles emulate the iconic look of the café racers and bobbers of yesteryear, but without all the noise and fumes. The UK-based Maeving has successfully married classic British motorcycle design with a zero-emission electric…"
First Look: The LiveWire S2 Mulholland electric cruiser,2024,https://kickstart.bikeexif.com/wp-content/uploads/2024/03/fb-15.jpg,"Even though it was born from the world’s most prolific cruiser company, the all-electric LiveWire brand’s catalog has been curiously devoid of any cruisers… until now. Get a load of the new $15,999 L… [+5262 chars]","Even though it was born from the world’s most prolific cruiser company, the all-electric LiveWire brand’s catalog has been curiously devoid of any cruisers… until now. Get a load of the new $15,999 LiveWire S2 Mulholland. LiveWire calls it an electric perform…"
Town and country: A custom Suzuki TU250 Grasstracker from Taiwan,2024,https://kickstart.bikeexif.com/wp-content/uploads/2024/04/fb-7.jpg,"As Taiwan’s relatively young custom scene continues to flourish, we have the privilege of watching plucky startups become established players. Take Twentytwo Custom; this custom Suzuki TU250 Grasstra… [+3806 chars]","As Taiwan’s relatively young custom scene continues to flourish, we have the privilege of watching plucky startups become established players. Take Twentytwo Custom; this custom Suzuki TU250 Grasstracker is only their seventh build, but it perfectly showcases…"
Fiido’s new T2 Longtail Cargo eBike will let you carry all your gear up to 68 miles per charge!,2024,https://the-gadgeteer.com/wp-content/uploads/2024/04/fiido-t2-2.jpg,"We use affiliate links. If you buy something through the links on this page, we may earn a commission at no cost to you. Learn more.
SPONSORED NEWS Fiido, a leading innovator in electric mobility so… [+3525 chars]","SPONSORED NEWS – Fiido, a leading innovator in electric mobility solutions, is proud to announce the launch of its newest addition to the eBike lineup, the Fiido T2 Longtail Cargo eBike.Understanding the diverse needs of riders in various scenarios, Fiido has…"
The NOVUS One Lightweight E-Moto Could Make City Commuting Fun,2024,https://cleantechnica.com/wp-content/uploads/2024/03/NOVUS_FoundersEdition_HorizonSilver_01-scaled.jpg,"Sign up for daily news updates from CleanTechnica on email. Or follow us on Google News!
The NOVUS One electric motorcycle is a quick and right-sized bike for getting around the city, bringing toget… [+3981 chars]","The NOVUS One electric motorcycle is a quick and right-sized bike for getting around the city, bringing together some great specs and an ultramodern look in a lightweight package. This lightweight little motorcycle could be a sweet choice for a zero-emission …"
This German Undertaker Uses An Electric Quadricycle As A Hearse,2024,https://cleantechnica.com/wp-content/uploads/2024/04/Das-Veload_Ueberblick-1.jpg,"Sign up for daily news updates from CleanTechnica on email. Or follow us on Google News!
Electric cargo bikes and trikes and quadricycles are being put to a wide variety of uses, from hauling materi… [+3093 chars]","Electric cargo bikes and trikes and quadricycles are being put to a wide variety of uses, from hauling materials to passengers to tools to packages, but what if your passenger is, say, dead? It turns out that electric cargo bikes can also make a great hearse,…"
"Mid South 2024: Ben’s Not-a-Sklar, Not-a-Tall Bike – Jarrod Bunk & Ben Witt",2024,https://media.theradavist.com/uploads/2024/03/Ben-Not-A-Sklar-2.jpg?w=1200&quality=75,"Tall as this bike may be it’s not a traditional tall bike, and although it was made by Adam Sklar, it’s not a traditional Sklar. Jarrod Bunk couldn’t resist getting a few snaps of Ben and his quirky … [+4099 chars]","Tall as this bike may be it's not a traditional tall bike, and although it was made by Adam Sklar, it's not a traditional Sklar. Jarrod Bunk couldn't resist getting a few snaps of Ben and his quirky not-tall bike at this year's Mid South. Let's take a closer …"
Hailey’s Crust Bombora: A Work in Progress – Hailey Moore,2024,https://media.theradavist.com/uploads/2024/04/Red_Feather_Ramble_A_Lavanchy_Sept_2021-04.jpg?w=1200&quality=75,"Part shape-shifter, part time capsule, Hailey‘s Crust Bikes Bombora has taken many forms. It’s the bike that she got when she first started really getting into bikes, and bike touring, and since then… [+14489 chars]","Part shape-shifter, part time capsule, Hailey's Crust Bikes Bombora has taken many forms. It’s the bike that she got when she first started really getting into bikes, and bike touring, and since then it’s the one she's altered the most, always finding a way t…"
This Outer Sunset Baker Mills His Grains in the Most San Francisco Way Possible,2024,https://cdn.vox-cdn.com/thumbor/WFVO21Z7qhoBVq5LGeqQT5KxAuI=/0x350:1439x1103/fit-in/1200x630/cdn.vox-cdn.com/uploads/chorus_asset/file/25346192/15D183E6_FC57_46C6_ACD9_30E4E74D36B0.JPG,"Bones Bagels and Bread

 


 Noah Orloff of Bones Bagels and Bread mills grain on a one-of-a-kind stationary bike then delivers his sourdough bread and bagels on two wheels With surfboards and campf… [+2864 chars]",Noah Orloff of Bones Bagels and Bread mills grain on a one-of-a-kind stationary bike then delivers his sourdough bread and bagels on two wheels
Revealed: The 2024 Husqvarna Svartpilen 801 breaks cover,2024,https://kickstart.bikeexif.com/wp-content/uploads/2024/03/fb-13.jpg,Husqvarna teased us two weeks ago with a camouflaged prototype of the long-awaited Svartpilen 801. The production version of the Husqvarna Svartpilen 801 has just broken coverand it’s pretty much the… [+4239 chars],"Husqvarna teased us two weeks ago with a camouflaged prototype of the long-awaited Svartpilen 801. The production version of the Husqvarna Svartpilen 801 has just broken cover—and it’s pretty much the same bike, sans stickers. Surprised?
The 2024 Husqvarna Sv…"
00/05: The NEIGHBORHOOD x Rough Crafts Harley Street Bob,2024,https://kickstart.bikeexif.com/wp-content/uploads/2024/04/fb-5.jpg,"Motorcycle enthusiasts are probably not as familiar with NEIGHBORHOOD as fashionistas are, but the powerhouse Japanese streetwear brand does have a strong connection to motorcycling. NEIGHBORHOOD’s c… [+5377 chars]","Motorcycle enthusiasts are probably not as familiar with NEIGHBORHOOD as fashionistas are, but the powerhouse Japanese streetwear brand does have a strong connection to motorcycling. NEIGHBORHOOD’s creative director, Shinsuke Takizawa, is a huge fan of motorc…"
"Review: Raaw Madonna V3 - Yes, It's Still Great",2024,https://ep1.pinkbike.org/p4pb26288106/p4pb26288106.jpg,"How Does It Compare?The Atherton S170 was recently released, another high-end aluminum option that's designed with similar intentions to the Raaw. The lugged construction of the S170 is the reason wh… [+1876 chars]","An aluminum frame that’s built to last, with more adjustability than ever.( Photos: 21, Comments: 2 )"
A Taiwanese Chain With Money Cakes Lands in Flushing,2024,https://cdn.vox-cdn.com/thumbor/8lP9gnMaAJggwKqoKtT5nSyRRWk=/0x252:3500x2084/fit-in/1200x630/cdn.vox-cdn.com/uploads/chorus_asset/file/25343894/Money_Cake_Taiwanese_Classics_1_Photo_Credit_Noah_Fecks.jpg,"Taiwanese wheel cakes get a rebrand at Money Cake. | Noah Fecks/Money Cake

 

 Plus, officials unveil plans for the city’s first “delivery worker hub” — and more intel The food court at Flushing’s … [+1554 chars]","Plus, officials unveil plans for the city’s first “delivery worker hub” — and more intel"
"Intense Sniper goes T-Type, Recluse Comes Back Outta Hiding",2024,https://bikerumor.com/wp-content/uploads/2024/04/tpe-24-2024-intense-sniper-t-pro-03.jpg,"While most recent coverage of Intense Cycles has focused on the upcoming M1 downhill bike and its 3D-printed alloy subframe, they have two new trail-oriented bikes already out… sorta.
Above, the new… [+1732 chars]","Intense shows off an updated Sniper with pressed carbon linkage, plus a Recluse reboot in alloy!
The post Intense Sniper goes T-Type, Recluse Comes Back Outta Hiding appeared first on Bikerumor."
The Orbea Diem E-Bike: Your Questions Answered,2024,"https://i.kinja-img.com/image/upload/c_fill,h_675,pg_1,q_80,w_1200/f1b1ba7139d4d2a5a1d275ca7cd8b39e.png","The battery on each Diem model is built into the frame, which means theres no pulling it out to take it inside to charge or keeping a spare battery handy whenever you need to swap. The team did, howe… [+538 chars]","Spanish bike builder Orbea has a slick new electric bike that promises to jazz up your daily commute. Called the Diem, the new bike launched earlier this month with a sleek looking frame, aShimano e-bike motor and neat flourishes like built in lights. Read mo…"
Win N1NO’s Scott Spark RC Custom Cape Epic XC Bike to Support World Bicycle Relief,2024,https://bikerumor.com/wp-content/uploads/2024/03/Scott-Spark-RC-x-Cape-Epic-special-edition-race-bike-for-Nino-Schurter-and-World-Bicycle-Relief-fundraiser_phpoto-by-Nick-Muzik_riding.jpg,"The season-opening Cape Epic kicked off marathon cross-country racing over the weekend, and we’re suckers for the custom XC bikes that the 2-person duos show up on. This year is the 20th anniversary … [+3112 chars]","Nino Schurter is racing a custom-painted Scott Spark at the Cape Epic. And you can win an exact copy raising money for World Bicycle Relief!
The post Win N1NO’s Scott Spark RC Custom Cape Epic XC Bike to Support World Bicycle Relief appeared first on Bikerumo…"
Strafe for Apres Cycling,2024,https://www.bikehugger.com/wp-content/uploads/2024/04/000008230015.jpeg,"I’ve been sporting Strafe for Apres cycling this winter and now into spring. Just like in snow sports, cyclists know how to celebrate post-ride, yet we often lack specific gear for those moments. Not… [+1750 chars]","I’ve been sporting Strafe for Apres cycling this winter and now into spring. Just like in snow sports, cyclists know how to celebrate post-ride, yet…
The post Strafe for Apres Cycling appeared first on Bike Hugger."
"2024 Philly Bike Expo: Chapman Cycles, Chumba Cycles, and Doom Bars – Brad Quartuccio",2024,https://media.theradavist.com/uploads/2024/03/2024-Philly-Bike-Expo-Chapman-Cycles-3.jpg?w=1200&quality=75,"Continuing our 2024 Philly Bike Expo coverage with more Reportage with words and photos by Brad Quartuccio, featuring Chapman Cycles, Chumba Cycles, and Doom Bars. Let’s get to it!

Chapman Cycles Al… [+2554 chars]","Continuing our 2024 Philly Bike Expo coverage with more Reportage with words and photos by Brad Quartuccio, featuring Chapman Cycles, Chumba Cycles, and Doom Bars. Let's get to it! Chapman Cycles All-Road Brian Chapman is a unique talent amongst the custom fr…"
Fat Bikes for All: State Bicycle Co. 6061 Trail+ Fat Bike Review – Shaun Price,2024,https://media.theradavist.com/uploads/2024/04/DSC08399.jpg?w=1200&quality=75,"This winter, Shaun Price took State’s 6061 Trail+ Fat Bike out around New Mexico and the Navajo Nation. It was his first time fat biking, making him the perfect test subject for this entry-level fat … [+12339 chars]","This winter, Shaun Price took State’s 6061 Trail+ Fat Bike out around New Mexico and the Navajo Nation. It was his first time fat biking, making him the perfect test subject for this entry-level fat bike model from State. Today, Shaun reviews the 6061 Trail+'…"
Updated Surly Big Easy 2.0 eCargo Bike Gets More Comfortable & Better at Hauling,2024,https://bikerumor.com/wp-content/uploads/2024/03/Surly-Updated-Big-Easy-hero.jpg,"Minnesota’s Surly Bikes has always championed the ethos that we should ride bikes and bring stuff as much as possible. And, they’re making it as easy as possible to do so with the release of the newl… [+2606 chars]","Carry more kids, more groceries, or just about anything else you can image with the Big Easy 2.0.
The post Updated Surly Big Easy 2.0 eCargo Bike Gets More Comfortable & Better at Hauling appeared first on Bikerumor."
AETHER MULHOLLAND MOTORCYCLE JACKET,2024,https://cdn.blessthisstuff.com/imagens/stuff/aether-mulholland-motorcycle-jacket.jpg,"Crafted with Aether's core philosophy in mind, the new Mulholland Motorcycle Jacket is both quietly technical and fully protective, ensuring you look and feel confident both on and off the bike. Its … [+1226 chars]","Crafted with Aether's core philosophy in mind, the new Mulholland Motorcycle Jacket is both quietly technical and fully protective, ensuring you look and feel confident both on and off the bike. Its seam-taped and waterproof construction, provides ultimate pr…"
Lightning Strike: A Buell XB12S street fighter from France,2024,https://kickstart.bikeexif.com/wp-content/uploads/2024/03/fb-14.jpg,"Buell’s tempestuous history is sprinkled with moments of sheer motorcycling brilliance. And the XB series of the early 2000s ranks high on the American motorcycle company’s list of greatest hits.
Th… [+3517 chars]","Buell’s tempestuous history is sprinkled with moments of sheer motorcycling brilliance. And the XB series of the early 2000s ranks high on the American motorcycle company’s list of greatest hits.
The Buell XB had tongues wagging for an array of reasons when i…"
"‘That Kid’s Insane’: Chris Hemsworth’s Son Ripped It Up On A Mini-Bike In New Video, And I Think We Have A Movie Star In The Making",2024,https://cdn.mos.cms.futurecdn.net/bEWQYQu4JyCqLMXBvviUjK-1200-80.jpg,"When Chris Hemsworth isn’t busy filming some of the biggest film franchises in the movie business, it’s likely that he’s spending time with his loved ones. The Australia-born star has certainly shown… [+3617 chars]","Chris Hemsworth shared a video of his son riding a mini-bike, and I'm wondering if he could be a movie star one day."
With Active Cruises More Popular Than Ever Backroads Adds New Options,2024,https://imageio.forbes.com/specials-images/imageserve/65f9be99592373e1704a8aff/0x0.jpg?format=jpg&height=900&width=1600&fit=bounds,"Active travel and cruising go great together, and until recently most bike and hike trips have used ... [+] river cruise ships, like this Backroads trip with AmaWaterways.
Courtesy of BACKROADS.
Le… [+7136 chars]","Both cruise travel and active travel have exploded in popularity, but it turns out the two types of vacations go great together."
Bike Of Hell The Hunt Guide – How To Get The Korblox Deathbike,2024,https://www.droidgamers.com/wp-content/uploads/2024/03/bike-of-hell-the-hunt.jpg,"There’s a hell of a course waiting for you in this The Hunt event, and a hell of a prize waiting for repeat players who want a new bike with a really sick aesthetic. It’s not one of those challenges … [+1464 chars]","Our Bike Of Hell The Hunt guide, going over how to find and complete the limited edition track and get the special bike.
The post Bike Of Hell The Hunt Guide – How To Get The Korblox Deathbike appeared first on Droid Gamers."
