Title,Publication Year,Image URL,Article Content,Article Description
Trek's FX+ 2 Electric Bike Is $500 off Right Now,2024,"https://media.wired.com/photos/637bf1c75f19e0abdaa1e267/191:100/w_1280,c_limit/Trek-FX+-2-Featured-Gear.jpg","Here in the Pacific Northwest, spring has sprung. Yes, it is but a false spring, and by the end of the week, we will again be moping through chilly gloom and rain. But for the time being, the sun is … [+2606 chars]","Welcome to TrekFest, Trek's yearly sale on electric bikes, helmets, shoes, and everything you need for spring cycling."
Cowboy’s new all-road e-bike adds suspension and a much bigger battery,2024,,"Si vous cliquez sur « Tout accepter », nos partenaires (y compris 241 qui font partie du Cadre de transparence et de consentement dIAB) et nous utiliserons également des témoins et vos données person… [+982 chars]","Like many premium electric rides, Cowboy's e-bikes make short commutes easier, especially those involving hills or a lot of stop-start traffic. Its latest bike is an attempt to address another challenge: comfort. The Cowboy Cross is the company’s first “all-r…"
Police officer borrows passer-by's bike to chase down suspect,2024,https://ichef.bbci.co.uk/news/1024/branded_news/35A4/production/_133123731_11onlinestill3-1.jpg,"A man has been arrested after a ""strange"" pursuit in which a police officer ditched his car in favour of a passer-by's bike in Rotherham.
The chase started after the driver of a Range Rover Evoque w… [+789 chars]",A police officer gives chase in Rotherham - after a passer-by offers his bike.
"Girl, 5, dies after bike collides with lorry",2024,https://ichef.bbci.co.uk/news/1024/branded_news/2BD6/production/_133122211_mediaitem133122210.jpg,"A five-year-old girl has died after colliding with an HGV lorry while riding a bike in Hull.
Humberside Police were called to Hopewell Road in the Bilton Grange area at 15:40 BST on Thursday.
Despi… [+653 chars]",Humberside Police were called to Hopewell Road in the Bilton Grange area of Hull on 11 April.
Kickstart Your Fitness Journey With Amazon Spring Savings on Peloton Bikes and Accessories - CNET,2024,https://www.cnet.com/a/img/resize/60be8a2d743ee21841edb03efa25edf376cb8239/hub/2023/11/07/8387f829-100c-4750-b2b0-bcf0ec78327d/artboard-4.jpg?auto=webp&fit=crop&height=675&width=1200,"Kicking things off, we have the bike that started it all. The Peloton Bike is now just $1,250, a price that saves you $195 off the usual going rate. For that price, you'll get an immersive 22-inch HD… [+1559 chars]",Amazon's Big Spring Sale is taking up to $395 off Peloton Bikes and as much as 51% off accessories and apparel.
Motorcyclist falls from bridge after car collision,2024,https://ichef.bbci.co.uk/news/1024/branded_news/6FA0/production/_132967582_p0hkmcc3.jpg,"Video showed the moment a motorcyclist was thrown from his bike and over a bridge after being hit by a car.
Police said driver Nikesh Mistry, 34, had forced the rider on to the wrong side of the car… [+884 chars]",Video shows a rider being pushed against railings by a car after a disagreement with its driver.
How I Became a Python Programmer—and Fell Out of Love With the Machine,2024,"https://media.wired.com/photos/6610648a166b9261242e3e90/191:100/w_1280,c_limit/Django.jpg","The difficulty with any new programming language is the sharp learning curve, all that drudgery and bashing your forehead into the keyboard. There was no Codecademy or Stack Overflow in those days. W… [+3459 chars]","When I started coding, I was suspicious of all the abstractions. Then I discovered the Django framework."
Vingegaard suffers broken collarbone & ribs in crash,2024,https://ichef.bbci.co.uk/news/1024/branded_sport/88B5/production/_133079943_gettyimages-2132813290.jpg,"Reigning Tour de France champion Jonas Vingegaard suffered a broken collarbone and several broken ribs following a high-speed crash at the Itzulia Basque Country stage race.
Vingegaard, 27, was amon… [+1430 chars]",Reigning Tour de France champion Jonas Vingegaard suffers a broken collarbone and several broken ribs in a crash at the Itzulia Basque Country stage race.
TNW Podcast: We try the new Cowboy bike and talk to the founders,2024,https://img-cdn.tnwcdn.com/image/tnw-blurple?filter_last=1&fit=1280%2C640&url=https%3A%2F%2Fcdn0.tnwcdn.com%2Fwp-content%2Fblogs.dir%2F1%2Ffiles%2F2023%2F12%2Ftnw-podcast-feat-1.png&signature=1ca57b225d69caf0b718b7a8dc0fc9a9,Welcome to the new episode of the TNW Podcast the show where we discuss the latest developments in the European technology ecosystem and feature interviews with some of the most interesting people in… [+534 chars],"Welcome to the new episode of the TNW Podcast — the show where we discuss the latest developments in the European technology ecosystem and feature interviews with some of the most interesting people in the industry. In today’s episode, Andrii and Linnea talk …"
A Drone Motor Does e-Bikes,2024,https://hackaday.com/wp-content/uploads/2024/04/drone-bike-featured.jpg,"On paper, the motors from both an electric bicycle and a drone can both take about 500 watts or so of power. Of course, their different applications make them anything but equivalent, as the bike mot… [+1091 chars]","On paper, the motors from both an electric bicycle and a drone can both take about 500 watts or so of power. Of course, their different applications make them anything but equivalent, as the bike m…"
TOMOS Moped Becomes Electric Beast,2024,https://hackaday.com/wp-content/uploads/2024/03/tomos-featured.jpg,"The TOMOS 50cc moped, a small motorcycle produced in Yugoslavia and the Netherlands, has for decades been a common sight on European roads and provided the first taste of transport independence for c… [+1042 chars]","The TOMOS 50cc moped, a small motorcycle produced in Yugoslavia and the Netherlands, has for decades been a common sight on European roads and provided the first taste of transport independence for…"
CAROL Bike,2024,https://uncrate.com/p/2024/03/carol-bike-1.jpg,"For non-aficionados, the wine aisle can be a daunting place. Instead of leaving your choices up to the allure of the label, give Naked Wines a try. They pick wines that match your tastes, determined … [+451 chars]","The number one reason most people don't work out is lack of time. Offering the shortest, most effective, and most accessible way to exercise, CAROL is the fastest way to get fit. The smart exercise bike uses a combination of..."
"Children need protection from drug gangs, expert says",2024,https://ichef.bbci.co.uk/news/1024/branded_news/E17F/production/_132972775_stillalexisjay.jpg,"Tens of thousands of children are at risk of being groomed and coerced into crime by organised gangs, according to a leading child-protection expert.
Prof Alexis Jay, who revealed the extent of sexu… [+4733 chars]","Tens of thousands of children are at risk of being groomed and coerced into crime, a leading expert says."
WATCH: Out-of-control Ferrari narrowly misses hitting jogger,2024,https://i.abcnewsfe.com/a/149e16b6-7187-4b3c-9ca0-f75f9a566cc3/240320_abc_social_ferrari_hpMain_16x9.jpg?w=992,"<ul><li>Whats next for Russia? 
</li><li>What comes next after Texas school shooting?
</li><li>What's next for abortion rights in America?
</li><li>The new battle for voting rights
</li><li>How w… [+2284 chars]",A Ferrari appeared in a video to narrowly avoid a runner as it crashed into a bike rack in the English city of Norwich.
Mod SideCar Electric Bike,2024,https://uncrate.com/p/2024/04/mod-sidecaar-e-bike-1.jpg,"Summer is coming soon, and while we hope you're not wearing dress socks to the beach, you can start mentally preparing for the surf and sand with these Seaside Dress Calf Socks from Bombas. Made from… [+516 chars]","The MOD Easy SideCar 3 is exactly what it says on the tin — a retro-styled electric bike equipped with the handiest invention since the bicycle itself. Sized for children, pets, and cargo, the Easy SideCar 3 can carry a..."
MOD Easy Sidecar 3 e-bike review: twice the fun,2024,https://www.digitaltrends.com/wp-content/uploads/2024/04/Happy-the-Double-Doodle-relaxing-in-the-MOD-Easy-3-Sidecar-parked-on-the-side-of-a-neighborhood-street.jpg?resize=1200%2C630&p=1,"Bruce Brown / Digital Trends
If you’re uncomfortable with more than moderately good times and balk at outrageous hilarity, MOD Bikes’ Easy Sidecar 3 may be a bit much to handle. For everybody else, … [+8776 chars]","The MOD Easy 3 is a third-generation, old-timey-looking e-bike available with or without the sidecar."
Indonesia's e-bike shops are building their own batteries,2024,https://149346090.v2.pressablecdn.com/wp-content/uploads/2024/03/NYIMASLAULA_ROW_Bali_Ebike_8579-1600x900.jpg,"Dharmawan Kusna Handoyo spends his workday in a 2-by-3-meter cubicle, soldering batteries. He has been building DIY battery packs since 2009, when he installed one in his own electric bike but in the… [+5857 chars]","Battery-pack builders chase maximum range, despite safety risks."
Himiway C5 e-bike review: looks and rides like a motorcycle,2024,https://www.digitaltrends.com/wp-content/uploads/2024/04/Himiway-C5-Motorbike-with-flashing-lights-on-battery-and-cup-in-the-cupholder.jpg?resize=1200%2C630&p=1,"Bruce Brown / Digital Trends
At first glance, you might think we got it wrong and that this is a motorcycle review, but it’s not. The Himiway C5, also known as the C5 Ultra, looks and rides more lik… [+8423 chars]","The Himiway C5 looks, feels, and rides more like a small motorcycle than a regular e-bike."
WATCH: E-bike explodes into flames at train station in England,2024,https://i.abcnewsfe.com/a/3099484c-1a1a-4b5d-aa79-cc1dfeded433/240409_abc_social_ebike_hpMain_16x9.jpg?w=992,"<ul><li>Whats next for Russia? 
</li><li>What comes next after Texas school shooting?
</li><li>What's next for abortion rights in America?
</li><li>The new battle for voting rights
</li><li>How w… [+2284 chars]","Surveillance footage captured the moment an e-bike battery suddenly started smoking and exploded into flames on a train platform in the U.K., with waiting passengers seen scrambling for safety."
Lectric XPeak e-bike review: setting a new standard for adventure bikes,2024,https://www.digitaltrends.com/wp-content/uploads/2024/03/Lectric-XPeak-right-rear-three-quarter-view-parked-on-forest-path.jpg?resize=1200%2C630&p=1,"Bruce Brown / Digital Trends
Lectric eBikes continues to disrupt e-mobility industry pricing with the excellent Lectric XPeak, an on-road and off-road fat-tire adventure e-bike. Tough, capable, comf… [+8122 chars]","As with Lectric's XP 3.0 folding e-bike, the XPeak's quality at a low cost will prompt competitors to slash prices."
A Stylish Folding E-Bike,2024,https://s3files.core77.com/blog/images/lead_n_spotlight/1534630_lead_400_131860_.jpg,"This PSF1, by Taiwanese manufacturer BESV, is an e-bike that's easy on the eyes.
Conveniently, it folds down for transport or apartment storage.
An LCD display indicates your speed, range, battery … [+412 chars]","This PSF1, by Taiwanese manufacturer BESV, is an e-bike that's easy on the eyes. Conveniently, it folds down for transport or apartment storage.
An LCD display indicates your speed, range, battery life, and which of the four assistance modes you're in. It's …"
Get Up to $450 Off Top Rowing Machines During Hydrow's Easter Sale - CNET,2024,https://www.cnet.com/a/img/resize/a529b5bb01a52f1aa94dcb84bff42d04ca375a50/hub/2023/11/09/8922d72f-80d8-4e42-8e4e-96b2bda9f83a/hydrow-wave-rowing-machine-bf.jpg?auto=webp&fit=crop&height=675&width=1200,"If you've set any wellness goals, having some new home gym equipment can help motivate you to make movement a daily habit. If you don't already own a rower, you'll find that it can help you get a hig… [+1578 chars]","Slay those fitness goals with a new machine that gives you a high-intensity, low-impact workout every time."
"Space-Efficient, Paternoster-like Bike Storage Lockers",2024,https://s3files.core77.com/blog/images/lead_n_spotlight/1533492_lead_400_131800_.jpg,"Underground bike storage systems, like those seen in Japan, are amazing. But they obviously require a massive amount of excavation and construction.
A Swiss company called V-Locker has designed an e… [+989 chars]","Underground bike storage systems, like those seen in Japan, are amazing. But they obviously require a massive amount of excavation and construction.A Swiss company called V-Locker has designed an easier-to-implement solution. The company has developed tower m…"
7 Fitness Hacks to Sneak in Exercise Painlessly Every Day - CNET,2024,https://www.cnet.com/a/img/resize/a7bb44d53e74370087584d122d47419a78d6d84f/hub/2023/02/17/c105467e-058c-46a0-9a05-46ea117f777b/gettyimages-960937940.jpg?auto=webp&fit=crop&height=675&width=1200,"I'm far from the first person to say it, but exercise is essential for our overall health. Exercise helps with boosting your mood, relieving stress, increasing energy, improving sleep quality and low… [+6820 chars]",Incorporating these exercises is much easier than you think and won't leave you feeling miserable.
Make the Switch to an E-Bike During This Huge Sale at Upway - CNET,2024,https://www.cnet.com/a/img/resize/a54701eae3b2fe96a00be811d8a36330fe3b0739/hub/2024/03/13/6069dffa-0ebf-4c9c-b074-af25f4fb6ae1/artboard-7-6.png?auto=webp&fit=crop&height=675&width=1200,"E-bikes and other rideables are making waves, offering a green alternative to commuting via car, while generally being faster than public transit or making your way on foot. Upway is offering you big… [+1145 chars]","Go green with an e-bike and save up to $1,000 on your purchase."
"E-bike subsidies should be more widespread, following the lead of Colorado ($450...",2024,,"×Hello! In order to leave a comment, you need to be a current kottke.org member. If you'd like to sign up for a membership to support the site, you can explore your options here.
Existing members ca… [+368 chars]","E-bike subsidies should be more widespread, following the lead of Colorado ($450 back on a bike purchase). “More than half o"
How to give kids autonomy? 'Anxious Generation' author says a license to roam helps,2024,https://media.npr.org/assets/img/2024/04/12/pxl_20240412_210909065_wide-71b76f4f93a3c5d56517fbd5a3804dbc0a0df7ee-s1400-c100.jpg,"The author's 8-year-old daughter Rosy has a 'kids' license,' showing she has her parents' permission to ride her bike around her Texas hometown.
Michaeleen Doucleff
American kids are being walloped… [+6956 chars]","Kids have too much screen time and not enough autonomy, says author Jonathan Haidt. His book The Anxious Generation argues this has caused an epidemic of mental illness and suggests ways to fix it."
Save on a 4-Pack of Apple's AirTags and Never Lose Your Stuff Again - CNET,2024,https://www.cnet.com/a/img/resize/70449a0c0a11d94d8c789da36639709f23825d82/hub/2023/11/20/69a8003f-39fd-454c-98b3-160c1bf52f21/airtag-4-pack-bf.jpg?auto=webp&fit=crop&height=675&width=1200,"Losing your wallet, bag, or anything else is never a fun time and that's what makes item trackers so handy. Apple's AirTag item trackers are among the most popular and while they aren't always the ch… [+1816 chars]",You can get four Apple AirTags for just $20 apiece when you clip the on-page coupon at Amazon.
A Cheeky Bike Rack with a Clear Point of View,2024,https://s3files.core77.com/blog/images/lead_n_spotlight/1532042_lead_400_131720_.jpg,"Adrien Rovero, a Swiss industrial designer who runs his own firm in Renens, designed this cheeky VD003 bike rack:
""VD003 is a car-shaped bicycle rack which holds six bikes in the space that one car … [+273 chars]","Adrien Rovero, a Swiss industrial designer who runs his own firm in Renens, designed this cheeky VD003 bike rack:""VD003 is a car-shaped bicycle rack which holds six bikes in the space that one car would take up. It was designed to sensibilize car users to the…"
"Thule, Yakima and Kuat racks and roof boxes never go on sale. Right now you can save hundreds at REI",2024,https://s.aolcdn.com/images/dims3/GLOB/legacy_thumbnail/1062x597/format/jpg/quality/100/https://s.aolcdn.com/os/ab/_cms/2024/03/20131553/Kuat_Web_2021_Piston_PageMap-4_1.jpg,"Autoblog may receive a share from purchases made via links on this page. Pricing and availability are subject to change.
When it comes to outdoor gear for your car, Thule, Yakima and Kuat are some o… [+6133 chars]","Filed under:
 Commerce
 Continue reading Thule, Yakima and Kuat racks and roof boxes never go on sale. Right now you can save hundreds at REI
Thule, Yakima and Kuat racks and roof boxes never go on sale. Right now you can save hundreds at REI originally appea…"
"Top 10 Electric Bikes That Fuse Lethal Good Looks, Speed & An Eco-Friendly Ethos",2024,https://www.yankodesign.com/images/design_news/2024/03/top-10-electric-bikes/top_10_electric_bikes_yanko_design_hero.jpeg,"A lethal and menacing electric bike can set any automotive lover’s heart thumping! Bikes are pretty thrilling themselves, but when you make them electric, they become a match made in heaven. They’re … [+5169 chars]","Top 10 Electric Bikes That Fuse Lethal Good Looks, Speed & An Eco-Friendly EthosA lethal and menacing electric bike can set any automotive lover’s heart thumping! Bikes are pretty thrilling themselves, but when you make them electric, they..."
Concrete Clears its Own Snow,2024,https://hackaday.com/wp-content/uploads/2024/03/concrete-main.jpg,"Humans are not creatures well suited to cold environments. Without a large amount of effort to provide clothing, homes, and food to areas with substantial winters, very few of us would survive. The s… [+1653 chars]","Humans are not creatures well suited to cold environments. Without a large amount of effort to provide clothing, homes, and food to areas with substantial winters, very few of us would survive. The…"
Could a Luxury Car Brand like Audi get into Fitness Equipment?,2024,https://www.yankodesign.com/images/design_news/2024/04/auto-draft/audi_stationary_exercise_bike_1.jpg,"Luxury car brands don’t sell transportation… they sell a lifestyle, so what if you carried that idea to any other category? Designer Qingsheng Meng asked themself the same question, wondering what wo… [+3317 chars]","Could a Luxury Car Brand like Audi get into Fitness Equipment?Luxury car brands don’t sell transportation… they sell a lifestyle, so what if you carried that idea to any other category? Designer Qingsheng Meng asked..."
Top 10 Sleek & Swift Bicycles Designed For Some Old-School Eco-Friendly Commuting,2024,https://www.yankodesign.com/images/design_news/2024/04/10-best-bicycles-for-some-old-school-commuting/10_best_bicycle_designs_yanko_design_hero.webp,"We’re in a time and age where people have started living more sustainably and consciously, and this is reflected in their everyday decisions. They’re making changes in their daily lives, consumption,… [+5746 chars]","Top 10 Sleek & Swift Bicycles Designed For Some Old-School Eco-Friendly CommutingWe’re in a time and age where people have started living more sustainably and consciously, and this is reflected in their everyday decisions. They’re making..."
Sunday Firesides: Careful Kills,2024,https://content.artofmanliness.com/uploads/2024/03/carfeful-thumb.jpg,"When youre first learning to ride a bike, it can be frightening to get up some speed. But this is exactly what will make the ride a success. Take it too slow, and down you go.
A similar principle is… [+1426 chars]","When you’re first learning to ride a bike, it can be frightening to get up some speed. But this is exactly what will make the ride a success. Take it too slow, and down you go. A similar principle is at work in mountain biking. When you spot an obstacle up ah…"
"Karen accosts dude at campsite, tries to steal his heater, slashes his bike tires as payback",2024,https://i.chzbgr.com/thumb1200/25001477/hD4CB85FC/karen-accosts-woman-at-campsite-tries-to-steal-her-heater-slashes-womans-bike-tires-as-payback,"Apparently, the biggest threat when you're going camping is that you might spot a Karen or two lurking around. 
This Karen decided it was well within her right to shame another camper for having a n… [+745 chars]","Apparently, the biggest threat when you're going camping is that you might spot a Karen or two lurking around. 
This Karen decided it was well within her right to shame another camper for having a nice portable heater to keep him warm on a relatively cold ev…"
This Motocompo inspired café racer is born to perform stunning stoppies,2024,https://www.yankodesign.com/images/design_news/2024/03/this-motocompo-inspired-cafe-racer-will-be-a-treat-to-perform-stoppies/Motorcycle-MK1-Industrial-14.jpg,"Concept bike designs are one of the most interesting projects we come across on Behance. They can be amazingly detailed, utterly impractical, or just plain bizarre at times. We try acquaint all you m… [+1528 chars]","This Motocompo inspired café racer is born to perform stunning stoppiesConcept bike designs are one of the most interesting projects we come across on Behance. They can be amazingly detailed, utterly impractical, or just plain..."
"Cowboy Launches 'Cross', its Latest All-Terrain E-Bike",2024,https://image-cdn.hypb.st/https%3A%2F%2Fhypebeast.com%2Fimage%2F2024%2F03%2Fcowboy-launches-cross-its-latest-all-terrain-e-bike-tw.jpg?w=1080&cbr=1&q=90&fit=max,"Cowboy has unveiled its latest e-bike, Cross, an “all-road” model built for both city roads and rougher terrain. With its latest release the Brussels-based brand has bucked the recent trend of e-bike… [+2609 chars]","Cowboy has unveiled its latest e-bike, Cross, an ""all-road"" model built for both city roads and rougher terrain. With its latest release the Brussels-based brand has bucked the recent trend of e-bike companies going bust, instead doubling down with additions …"
Bring your pet while riding your bike with trailer and backpack in one,2024,https://www.yankodesign.com/images/design_news/2024/03/bring-your-pet-while-riding-your-bike-with-trailer-and-backpack-in-one/1.jpg,"For fur parents that have bikes and need to bring their babies with them outside, having somewhere to place their pet safely and conveniently can sometimes be a challenge. Fortunately, a lot of pet-r… [+1710 chars]","Bring your pet while riding your bike with trailer and backpack in oneFor fur parents that have bikes and need to bring their babies with them outside, having somewhere to place their pet safely and conveniently can..."
This futuristic dirt bike makes rugged details look less industrial and more eye-catching,2024,https://www.yankodesign.com/images/design_news/2024/04/auto-draft/x_tecnica_enduro_machine_1.jpg,There’s nothing glamorous about an MRI machine. There’s nothing glamorous about a welding machine. There’s nothing glamorous about a bare-basics car chassis. All these details were designed to fulfil… [+2772 chars],This futuristic dirt bike makes rugged details look less industrial and more eye-catchingThere’s nothing glamorous about an MRI machine. There’s nothing glamorous about a welding machine. There’s nothing glamorous about a bare-basics car chassis. All these de…
This Carbon-Fiber E-Bike Has A 750W Motor And The Soul Of An ATV,2024,https://www.yankodesign.com/images/design_news/2024/03/this-carbon-fiber-e-bike-has-a-750w-motor-and-the-soul-of-an-atv/Best_Carbon_Fiber_All_Terrain_Electric_Bike_hero.jpg,"Some people cycle for exercise, some do it for the commute, and some do it as a sport, exploring the toughest terrain on the planet. Common sense dictates that all those activities would require bicy… [+6150 chars]","This Carbon-Fiber E-Bike Has A 750W Motor And The Soul Of An ATVSome people cycle for exercise, some do it for the commute, and some do it as a sport, exploring the toughest terrain on the planet...."
Google could launch Find My Device network in early April,2024,https://readwrite.com/wp-content/uploads/2024/04/Google-could-launch-Find-My-Device-network-in-early-April.png,"Google has reportedly revealed the launch date of its Androids Find My Device network, which helps find the location of missing phones and accessories.
According to the online news site 9to5Google, … [+2410 chars]","Google has reportedly revealed the launch date of its Android’s Find My Device network, which helps find the location of… Continue reading Google could launch Find My Device network in early April
The post Google could launch Find My Device network in early A…"
65 Mile Range and a 500W Motor make this E-Bike Perfect for roads and rough terrain alike,2024,https://www.yankodesign.com/images/design_news/2024/04/65-mile-range-and-a-500w-motor-make-this-e-bike-perfect-for-roads-and-rough-terrain-alike/Elixe_EBike_Smart_Comfortable_Affordable_hero.jpg,"Even without bringing the economy up, needing to own two sets of e-bikes just sounds like a silly idea. Most urban commute bikes can’t endure off-road adventures, and rugged terrain-ready e-bikes are… [+5284 chars]","65 Mile Range and a 500W Motor make this E-Bike Perfect for roads and rough terrain alikeEven without bringing the economy up, needing to own two sets of e-bikes just sounds like a silly idea. Most urban commute bikes can’t endure..."
